equipo,Centro planif.,Ubicac.técnica,Denominación,Denominación.1,Activo fijo,Orden,Perfil catálogo,id_aviso,tipo_mantenimiento,descripcion,Fecha de aviso,Grupo códigos,TextoGrpPartObj,Cód.parte obj.,TextoCódPartObj,Grupo códigos.1,Código averia,TextoCódProblem,Causas avería,Causa,Txt. cód. mot.,causa_falla,fecha_inicio,hora_inicio,fecha_fin,hora_fin,Parada,duracion,Status sistema,Indicador ABC,fecha_inicio_dt,fecha_fin_dt,duracion_horas
20001479,VSA,OC-EST-VSA-PMED-BS37010,BRAZO MEDICIÓN SALIDA BS37010,VALVULA MOV_8X600- PRB 220-BS37010,45004434.0,,S_VA,236515,m2,pase en valvula mov 370112,6/10/2025,PO-S-060,Sub. Válvulas,S066,Empaque,SA-S-VA,INP1,Pase interno,,0,,nan,6/10/2025,9:40:52,,0:00:00,X,0,MEAB,2,2025-10-06 09:40:52,,0.0
20001658,VSA,OC-EST-VSA-PMED-BE3660,BRAZO MEDICIÓN DE ENTRADA BE3660,INDICADOR PRESION PI-3661 BRAZO 3660,,10048595.0,Z_XXXX,236512,m2,falla en el trasmisor de presion,4/10/2025,IPPI,Indicador de Presión,237,Indicador,SA-S-AM,FTF4,Falla de Control,,0,,nan,4/10/2025,12:41:31,,0:00:00,,0,METR ORAS,1,2025-10-04 12:41:31,,0.0
20001769,VSA,OC-EST-VSA-PMED-PR3010,PROBADOR DE MEDICIÓN PR3010,INDICADOR DIF. PRESION PDI-3010 PROOVER,,10048598.0,S_IN,236513,m2,falla proover ms3600 alarma dif de presi,4/10/2025,PO-S-010,Sub. Control y monitoreo,S014,Indicador o Sensor,SA-S-IN,FTF2,No resp bajo demanda o señal en Operac,,0,,nan,4/10/2025,17:07:06,,0:00:00,X,0,METR ORAS,1,2025-10-04 17:07:06,,0.0
20007928,VSA,OC-EST-VSA-PMED-BE3630,BRAZO MEDICIÓN DE ENTRADA BE3630,ACTUADOR MOV-3631 DE BRAZO MEDICION 3630,,10048596.0,Z_XXXX,236514,m2,falla actuador mov 3631,4/10/2025,ICEL,Control electronico,158,Display,SA-E-EP,AIR1,"Falsa alarma, indic. defectuosa de inst.",,0,,nan,4/10/2025,17:40:30,,0:00:00,X,0,METR ORAS,1,2025-10-04 17:40:30,,0.0
20024801,CUS,OC-EST-DES-PREC-BH20040,BAHIA DE RECIBO BH20040,CAJA REDUCTORA BOMBA CENTRIFUGA BAHIA 40,,10048592.0,R_PU,236505,m2,rotura elastomero bomba bahia 4,3/10/2025,PO-R-020,Sub. Lubricación,R027,Sensores,SA-R-PU,SER1,Piezas Mecánicas Sueltas,,0,,nan,3/10/2025,3:35:58,,0:00:00,X,0,METR ORAS,1,2025-10-03 03:35:58,,0.0
20003434,EPO,OC-EST-EPO-ALOC-ED,EDIFICACIONES,EDIFICACION LABORATORIO,46000803.0,10048600.0,Z_XXXX,236504,m2,extractor de laboratorio en falla,2/10/2025,BLBL,Compresor Sopladores/Ventiladores,259,Lineas de aire,SA-R-BL,NOI1,Ruido fuera de lo Normal,,0,,nan,2/10/2025,17:38:07,,0:00:00,X,0,METR ORAS,1,2025-10-02 17:38:07,,0.0
20008863,EPO,OC-EST-EPO-PMED-CA38000,MEDICIÓN CALIDAD CA38000,"MEZCLADOR ESTÁTICO 24"" SALIDA SMD APO",,10048602.0,I_MI,236502,m2,bomba de homogenizacion de altos,2/10/2025,PO-I-040,Sub. Control y Monitoreo,I040,Cableado y Caja de Conexiones,SA-I-MI,AIR1,"Falsa alarma, indicador defectuoso.",,0,,nan,2/10/2025,17:12:44,,0:00:00,X,0,METR ORAS,1,2025-10-02 17:12:44,,0.0
20008874,EPO,OC-EST-EPO-PMED-CA38000,MEDICIÓN CALIDAD CA38000,TOMAMUESTRAS CALIDAD 38,,10048603.0,S_IN,236503,m2,sello de bomba toma muestras altos,2/10/2025,PO-S-120,Sub. Misceláneos,S128,Tubería / Válvulas,SA-S-IN,SER1,Piezas Mecánicas Sueltas,,0,,nan,2/10/2025,17:30:46,,0:00:00,X,0,METR ORAS,2,2025-10-02 17:30:46,,0.0
20011146,CUS,OC-EST-DES-ALOC-ED,EDIFICACIONES,EDIFICACION CASETA BAHIAS,42005557.0,10048591.0,Z_XXXX,236494,m2,falla escalera basculante bahia 7 desc,30/09/2025,PO-I-010,Sub. Estructura e Internos,I015,Pedestal / Soporte,SA-I-CR,STD1,"Daño material, grietas, desgaste, corr.",,0,,nan,30/09/2025,22:46:39,,0:00:00,X,0,METR ORAS,1,2025-09-30 22:46:39,,0.0
20022274,VSA,OC-EST-VSA-PMED-BE3610,BRAZO MEDICIÓN DE ENTRADA BE3610,MEDIDOR FLUJO BRAZO MED BE3610,45004396.0,10048585.0,S_IN,236493,m2,falla medidor de flujo brazo 1 fqe-36010,30/09/2025,PO-S-010,Sub. Control y monitoreo,S014,Indicador o Sensor,SA-S-IN,AIR2,Falsa alarma e indicación,,0,,nan,30/09/2025,7:12:08,,0:00:00,X,0,METR ORAS,3,2025-09-30 07:12:08,,0.0
20008294,CQO,OC-EST-CQO-SREN-RECORODI,RECOLECCION - RECOLECTOR DE RODILLOS,RECOLECTOR RODILLOS ELASTEC 100,42005029.0,,S_EQ,236489,m2,alta presion sist combust elastec100,29/09/2025,PO-R-050,Sub. Combustión,R054,Bomba / Filtro,SA-R-PU,ELP3,Fuga ext. Combustible - Fluido Proceso,,0,,nan,29/09/2025,21:56:32,,0:00:00,X,0,MEAB,4,2025-09-29 21:56:32,,0.0
20024351,CVA,OC-TER-CVA-ADRE-DA,DRENAJE ABIERTO,MEDIDOR FLUJO VERTIMIENTO DRENAJE ABIERT,,10048577.0,Z_XXXX,236486,m2,falla medidor de caudal en vertimiento,29/09/2025,IPFS,Detector de Flujo (flujostato),446,Tarjeta electronica,SA-S-IN,ERO3,Señal errática,,0,,nan,29/09/2025,13:41:08,,0:00:00,X,0,METR ORAS,1,2025-09-29 13:41:08,,0.0
20015799,PAE,OC-EST-PAE-AAIR-CO54010,PAQUETE DE AIRE COMPRIMIDO CO54010,COMPRESOR TORNI AIRE 125PSIG  UGEN CO10,42004597.0,10048578.0,R_CO,236483,m2,revision compresor de aire_co10,29/09/2025,PO-R-030,Sub. Control y Monitoreo,R034,Unidad de Control,SA-R-CO,AIR1,"Falsa alarma, indicador defectuoso.",,0,,nan,29/09/2025,8:24:12,,0:00:00,X,0,METR ORAS,1,2025-09-29 08:24:12,,0.0
20014377,CQO,OC-EST-CQO-AGEN-GE22010,GENERADOR PRINCIPAL 10,MOTOR COMB GE-010,42003447.0,,R_CE,236482,m2,fuga agua sist lt por cooler 1era etapa,28/09/2025,PO-R-090,Sub. Refrigeración,R092,Intercambiador de Calor / Radiador,SA-R-CE,OHE1,Alta temperatura,,0,,nan,28/09/2025,21:24:55,,0:00:00,X,0,MEAB,3,2025-09-28 21:24:55,,0.0
20022162,LBE,OC-EST-LBE-AAGU-RS,AGUA RESIDUAL,STARD LBE,42004337.0,70021349.0,A_TD,236478,m2,caja electrica en mal estado ptar,26/09/2025,PO-A-020,Sub. Eléctrico e Instrumentación,A022,Acometida eléctrica,SA-A-TD,DEP5,Bajo Nivel,,0,,nan,26/09/2025,17:49:46,,0:00:00,X,0,METR ORAS,1,2025-09-26 17:49:46,,0.0
20004440,MRF,OC-EST-MRF-ACOM-CRUDO,COMBUSTIBLE CRUDO,VALVULA 5203 ALFA LAVAL 5210,,70016385.0,S_VA,236475,m2,alfa laval b apertura valvula no funcion,26/09/2025,PO-S-060,Sub. Válvulas,S063,Cuerpo de la Válvula,SA-S-VA,ELP1,Fuga externa de aire - Fluido de Proceso,,0,,nan,26/09/2025,1:03:51,,0:00:00,X,0,METR ORAS,2,2025-09-26 01:03:51,,0.0
20001243,VSA,OC-EST-VSA-SALV-TQ55000,TANQUE RELEVO ALIVIO TQ5500,TRANSMISOR NIVEL RADAR TK-55000,,10048582.0,S_IN,236479,m2,falla señal radar tq55000 en hmi,26/09/2025,PO-S-010,Sub. Control y monitoreo,S014,Indicador o Sensor,SA-S-IN,NOO1,No hay señal,,0,,nan,26/09/2025,18:28:43,,0:00:00,,0,METR ORAS,4,2025-09-26 18:28:43,,0.0
20022614,CUS,OC-EST-DES-PMED-CPME,CONEXIÓN DE MEDICION,TUBERIA CABEZAL TKS OC,42005471.0,10047730.0,I_PI,235527,m2,falla valvula controladora pcv-300001,25/01/2025,PO-I-040,Sub. Control y Monitoreo,I045,Tubería / Válvulas,SA-I-PI,ELP1,Fuga externa de aire - Fluido de Proceso,,0,,nan,25/09/2025,7:00:00,25/09/2025,17:00:00,X,10,METR ORAS,2,2025-09-25 07:00:00,2025-09-25 17:00:00,10.0
20005132,CVA,OC-TER-CVA-SCIN-ES,ESPUMA CONTRAINCENDIOS,TANQUE SIST ESPUMA,42005148.0,,I_TA,236463,m2,tanque de espuma sci ocensa,25/09/2025,PO-S-100,Sub. de Espuma,S102,Tanque de Almacenamiento Espuma,SA-I-TA,DEP5,Bajo Nivel,,0,,nan,25/09/2025,6:03:12,,0:00:00,X,0,MEAB,4,2025-09-25 06:03:12,,0.0
20005136,CVA,OC-TER-CVA-SCIN-ES,ESPUMA CONTRAINCENDIOS,MOTOR DIESEL SIST ESPUMA,42005149.0,10048559.0,S_FE,236470,m2,corrosion en estructura base bomba sci,25/09/2025,PO-I-020,Sub. Externo,I026,Pedestal / Soporte,SA-R-PU,STD1,"Daño material, grietas, desgaste, corr.",,0,,nan,25/09/2025,7:07:04,,0:00:00,X,0,METR ORAS,4,2025-09-25 07:07:04,,0.0
20024003,CVA,OC-TER-CVA-SCIN-AU,AGUA CONTRAINCENDIOS,TUBERIA ENTRADA AGUA IND ODC-OCENSA,,10048562.0,S_FE,236464,m2,rociadores anillo refrigeracion tk12010,25/09/2025,PO-R-090,Sub. Refrigeración,R095,Tubería / Válvulas,SA-I-PI,PLU3,Obstrucción Tubería por Agente Interno,,0,,nan,25/09/2025,6:12:16,,0:00:00,X,0,METR ORAS,4,2025-09-25 06:12:16,,0.0
20024003,CVA,OC-TER-CVA-SCIN-AU,AGUA CONTRAINCENDIOS,TUBERIA ENTRADA AGUA IND ODC-OCENSA,,10048563.0,S_FE,236466,m2,rociadores obstruidos del tk-12020,25/09/2025,PO-E-110,Sub. Refrigeración,E114,Tubería,SA-I-PI,PLU3,Obstrucción Tubería por Agente Interno,,0,,nan,25/09/2025,6:38:17,,0:00:00,X,0,METR ORAS,4,2025-09-25 06:38:17,,0.0
20024003,CVA,OC-TER-CVA-SCIN-AU,AGUA CONTRAINCENDIOS,TUBERIA ENTRADA AGUA IND ODC-OCENSA,,10048564.0,S_FE,236467,m2,rociadores obstruidos del tk-12030,25/09/2025,PO-E-110,Sub. Refrigeración,E114,Tubería,SA-I-PI,PLU3,Obstrucción Tubería por Agente Interno,,0,,nan,25/09/2025,6:48:41,,0:00:00,X,0,METR ORAS,4,2025-09-25 06:48:41,,0.0
20024003,CVA,OC-TER-CVA-SCIN-AU,AGUA CONTRAINCENDIOS,TUBERIA ENTRADA AGUA IND ODC-OCENSA,,70015692.0,S_FE,236469,m2,rociadores obstruidos tq-55000,25/09/2025,PO-E-110,Sub. Refrigeración,E114,Tubería,SA-I-PI,PLU3,Obstrucción Tubería por Agente Interno,,0,,nan,25/09/2025,7:01:23,,0:00:00,X,0,METR ORAS,4,2025-09-25 07:01:23,,0.0
20024004,CVA,OC-TER-CVA-SCIN-ES,ESPUMA CONTRAINCENDIOS,TUBERIA DISTRIBUCION AGUAESPUMA,,70018898.0,S_FE,236465,m2,camaras de espuma obstruidas tk-12010,25/09/2025,PO-S-100,Sub. de Espuma,S100,Cámara de Espuma,SA-I-PI,PLU3,Obstrucción Tubería por Agente Interno,,0,,nan,25/09/2025,6:29:44,,0:00:00,X,0,METR ORAS,4,2025-09-25 06:29:44,,0.0
20024004,CVA,OC-TER-CVA-SCIN-ES,ESPUMA CONTRAINCENDIOS,TUBERIA DISTRIBUCION AGUAESPUMA,,10048565.0,S_FE,236468,m2,camaras de espuma obstruisas tk12030,25/09/2025,PO-S-100,Sub. de Espuma,S100,Cámara de Espuma,SA-I-PI,PLU3,Obstrucción Tubería por Agente Interno,,0,,nan,25/09/2025,6:54:37,,0:00:00,X,0,METR ORAS,4,2025-09-25 06:54:37,,0.0
20010257,CVA,OC-TER-CVA-PALM-MU73,MÚLTIPLE DE ALMACENAMIENTO MU73,VALVULA MOV_20x150- LIN 710-MU73,45005242.0,10048554.0,S_VA,236458,m2,mov 731205 presenta falla d comunicacion,24/09/2025,PO-I-040,Sub. Control y Monitoreo,I045,Tubería / Válvulas,SA-S-VA,AIR2,Falsa alarma e indicación,,0,,nan,24/09/2025,6:01:21,,0:00:00,X,0,METR ORAS,2,2025-09-24 06:01:21,,0.0
20010299,CVA,OC-TER-CVA-PALM-MU73,MÚLTIPLE DE ALMACENAMIENTO MU73,VALVULA MOV_20x150- LIN 710-MU73,45005256.0,10048560.0,S_VA,236460,m2,falla tarjeta comunicacion mov-731106,24/09/2025,PO-I-040,Sub. Control y Monitoreo,I043,Monitoreo (PLC - Tarjetas - sensores),SA-S-CM,FTF4,Falla de Control,,0,,nan,24/09/2025,7:28:36,,0:00:00,X,0,METR ORAS,2,2025-09-24 07:28:36,,0.0
20008866,EPO,OC-EST-EPO-PMED-CA38000,MEDICIÓN CALIDAD CA38000,VALVULA CTRL PRES LOOP CALIDAD 38,45003458.0,10048573.0,S_VA,236462,m2,falla valvula 4 vias probador de altos,24/09/2025,PO-S-060,Sub. Válvulas,S065,Elemento de cierre,SA-S-VA,FTC1,No cierra cuando se da la orden,,0,,nan,24/09/2025,17:15:57,,0:00:00,X,0,METR ORAS,3,2025-09-24 17:15:57,,0.0
20016387,EPO,OC-EST-EPO-AGEN-GE22110,GENERADOR PRINCIPAL 10,TURBINA GAS MULTIET. GE10 12.9 MW,42003489.0,10048555.0,R_ST,236459,m2,fuga de gases calientes tg10,24/09/2025,PO-R-130,Sub. Turbina,R134,Sellos,SA-R-ST,OHE1,Alta temperatura,,0,,nan,24/09/2025,7:22:28,,0:00:00,X,0,METR ORAS,3,2025-09-24 07:22:28,,0.0
20009845,CCA,OC-EST-CCA-ACOM-CR,SISTEMA DE CRUDO COMBUSTIBLE,BOMBA CENTRIFUGA BC-52100,42004937.0,10048553.0,R_PU,236456,m2,coregir goteo bc 5211,23/09/2025,PO-R-040,Sub. Bombeo - Mezcla Fluidos,R047,Sellos,SA-R-PU,ELP2,Fuga externa crudo - Fluido Proceso,,0,,nan,23/09/2025,14:23:37,,0:00:00,X,0,METR ORAS,2,2025-09-23 14:23:37,,0.0
20011684,CVA,OC-TER-CVA-AELE-BTDICOV,BAJA TENSIÓN DICOV,CENTRO CONTROL MOTORES 20400,42005164.0,,E_MC,236455,m2,hallazgo goteras ccm 20400 dicov cva,23/09/2025,PO-U-070,Sub. Misceláneos,U070,Anclaje / Porta-lampara / Base,SA-U-OC,STD1,"Daño material, grietas, desgaste, corr.",,0,,nan,23/09/2025,8:52:13,,0:00:00,X,0,MEAB,3,2025-09-23 08:52:13,,0.0
20001364,VSA,OC-EST-VSA-ADRE-DC,DRENAJE CERRADO,SUMIDERO CONCR DC MEDICIÓN 3600,45004539.0,10048504.0,U_OC,236398,m2,taponamiento drenaje ms3600,2/09/2025,PO-U-070,Sub. Misceláneos,U072,Tubería / Válvulas,SA-U-OC,PLU3,Obstrucción Tubería por Agente Interno,C340,1,Desgaste normal del equipo,desgaste componentes,22/09/2025,8:00:00,23/09/2025,0:00:00,X,16,MECE ORAS,2,2025-09-22 08:00:00,2025-09-23 00:00:00,
20010440,EPO,OC-EST-EPO-ACOM-MZ1,CRUDO MEZCLA,AGITADOR MECANICO AGITADOR TC52080,45006473.0,10048552.0,I_MI,236450,m2,goteo de producto agitador tc-52080,22/09/2025,PO-I-010,Sub. Estructura e Internos,I017,Sellos / Juntas,SA-I-MI,ELP2,Fuga externa crudo - Fluido Proceso,,0,,nan,22/09/2025,8:52:04,,0:00:00,X,0,METR ORAS,1,2025-09-22 08:52:04,,0.0
20001215,VSA,OC-EST-VSA-SALV-PR,ALIVIO PRESIÓN,VAL SEG PSV-2307A FILTRO FASE I A MS7310,45004270.0,10048583.0,S_VS,236448,m2,falla psv 2307a,21/09/2025,PO-S-060,Sub. Válvulas,S067,Sellos,SA-S-VS,SPO1,Operación inesperada,,0,,nan,21/09/2025,4:42:16,,0:00:00,X,0,METR ORAS,4,2025-09-21 04:42:16,,0.0
20023579,EPO,OC-EST-EPO-AELE-BTBPC,BAJA TENSIÓN BOMBAS PRINCIPALES,TABLERO ELECT DISTRIBUCION VFD42080,,10048398.0,E_EP,236279,m2,falla interruptor bpc-42080,6/08/2025,PO-E-010,Sub. Circuito Alimentación,E014,Interruptor,SA-E-EP,FOV1,Voltaje salida equivocado o inestable,,0,,nan,19/09/2025,10:00:00,19/09/2025,11:00:00,X,1,METR ORAS,2,2025-09-19 10:00:00,2025-09-19 11:00:00,1.0
20002897,EPO,OC-EST-EPO-ADRE-DC,DRENAJE CERRADO,SUMIDERO ACERO DC BOOSTER,45006440.0,10045716.0,U_OC,233218,m2,sumidero tu-53300,25/09/2023,PO-U-070,Sub. Misceláneos,U072,Tubería / Válvulas,SA-U-OC,STD1,"Daño material, grietas, desgaste, corr.",C340,1,Desgaste normal del equipo,falla en la bomba neumatica,17/09/2025,7:00:00,17/09/2025,14:00:00,X,7,METR ORAS,2,2025-09-17 07:00:00,2025-09-17 14:00:00,7.0
20017117,CQO,OC-EST-CQO-AGEN-ACTE,S. ACEITE TERMICO GENERACION,TANQUE ACEITE TERMICO EXPANSION,42004426.0,10048549.0,I_TA,236432,m2,humedecimiento tanque aceite termico exp,17/09/2025,PO-S-120,Sub. Misceláneos,S127,Tanque o Piscina,SA-I-HB,STD1,"Daño material, grietas, desgaste, corr.",,0,,nan,17/09/2025,14:19:15,,0:00:00,X,0,METR ORAS,1,2025-09-17 14:19:15,,0.0
20016058,PAE,OC-EST-PAE-SCTR-DCS,SISTEMA DE CONTROL DISTRIBUIDO,UPS #2 20 KVA SHELTER SIS CONTROL,42003345.0,10048530.0,E_UP,236429,m2,falla baterias ups #2 20 kva sis control,17/09/2025,PO-E-080,Sub. Batería,E080,Banco de Baterías,SA-E-UP,FOV1,Voltaje salida equivocado o inestable,,0,,nan,17/09/2025,9:10:27,,0:00:00,X,0,METR ORAS,2,2025-09-17 09:10:27,,0.0
20021512,PAE,OC-EST-PAE-SCTR-TEL,SISTEMA DE TELECOMUNICACION,UPS #1 10 KVA SHELTER SIS COMUNIC,42004668.0,10048531.0,E_UP,236430,m2,falla baterias ups ups #1 10 kva comunic,17/09/2025,PO-E-080,Sub. Batería,E080,Banco de Baterías,SA-E-UP,FOV1,Voltaje salida equivocado o inestable,,0,,nan,17/09/2025,9:18:46,,0:00:00,X,0,METR ORAS,2,2025-09-17 09:18:46,,0.0
20021513,PAE,OC-EST-PAE-SCTR-TEL,SISTEMA DE TELECOMUNICACION,UPS #2 10 KVA SHELTER SIS COMUNIC,42004669.0,10048532.0,E_UP,236431,m2,falla baterias ups ups #2 10 kva comunic,17/09/2025,PO-E-080,Sub. Batería,E080,Banco de Baterías,SA-E-UP,FOV1,Voltaje salida equivocado o inestable,,0,,nan,17/09/2025,9:21:14,,0:00:00,X,0,METR ORAS,2,2025-09-17 09:21:14,,0.0
20005573,CVA,OC-TER-CVA-PMED-CA36000,MEDICIÓN CALIDAD CA36000,ANALIZADOR CALIDAD MS36000,45005497.0,10048528.0,S_IN,236428,m2,falla tomamuestra de recibo 36000,16/09/2025,PO-S-120,Sub. Misceláneos,S128,Tubería / Válvulas,SA-S-IN,SER1,Piezas Mecánicas Sueltas,C340,1,Desgaste normal del equipo,falla tomamuestra de recibo 36000,16/09/2025,7:00:00,16/09/2025,16:48:00,X,"9,8",MECE ORAS,2,2025-09-16 07:00:00,2025-09-16 16:48:00,9.8
20025957,EPO,OC-EST-EPO-UENF-CCMPRINCIPAL,PAQUETE ENFRIAMIENTO CCM PRINCIPAL,AIRE AC SPLIT/VENT PQTE A CCM PRINCIPAL,,10048395.0,U_AI,236276,m2,alta temperatura vfd-42010,6/08/2025,PO-U-010,Sub. Aire Acondicionado,U013,Unidad Condensadora,SA-U-AI,FTF1,No resp bajo demanda o señal en emerg.,,0,,nan,15/09/2025,7:00:00,15/09/2025,9:00:00,X,2,METR ORAS,2,2025-09-15 07:00:00,2025-09-15 09:00:00,2.0
20001698,VSA,OC-EST-VSA-PMED-BE3680,BRAZO MEDICIÓN DE ENTRADA BE3680,VALVULA MOV_8X600- ENT 220-BE3680,45004427.0,10048443.0,S_VA,236317,m2,pase valvula mov-3680,13/08/2025,PO-S-060,Sub. Válvulas,S063,Cuerpo de la Válvula,SA-S-VA,INP1,Pase interno,,0,,nan,15/09/2025,7:00:00,15/09/2025,7:00:00,,0,MECE ORAS,2,2025-09-15 07:00:00,2025-09-15 07:00:00,0.0
20006302,CUP,OC-EST-CUP-PALM-TK50001,TANQUE DE ALMACENAMIENTO TK50001,MOTOR ELECT AGITADOR B TQ5001,45004105.0,10048526.0,R_EM,236426,m2,falla agm-5001b_no arranca,15/09/2025,PO-R-110,Sub. Motor Eléctrico,R110,Estator,SA-R-EM,LOO3,Salida por Baja Potencia,,0,,nan,15/09/2025,15:41:06,,0:00:00,X,0,METR ORAS,1,2025-09-15 15:41:06,,0.0
20023699,EPO,OC-EST-EPO-AAGU-PO,AGUA POTABLE,PLANTA TRAT AGUA POTABGEN,42005196.0,10048533.0,A_TP,236425,m2,fuga agua hidroflo planta ptap,15/09/2025,PO-A-010,Sub. Mecánico,A011,Bomba,SA-A-TP,STD1,"Daño material, grietas, desgaste, corr.",,0,,nan,15/09/2025,5:53:57,,0:00:00,X,0,METR ORAS,1,2025-09-15 05:53:57,,0.0
20010639,CVA,OC-TER-CVA-PMED-BS38060,BRAZO MEDICIÓN SALIDA BS38060,VALVULA MOV_16x150- DES 710-BS38060,45005494.0,10048267.0,S_VA,236145,m2,atascada hv entrada brazo 6 ms-38000,1/07/2025,PO-S-060,Sub. Válvulas,S063,Cuerpo de la Válvula,SA-S-VM,FTO1,No abre cuando se da la orden,C340,1,Desgaste normal del equipo,atascada hv entrada brazo 6 ms-38000,12/09/2025,7:00:00,12/09/2025,16:48:00,X,"9,8",MECE ORAS,2,2025-09-12 07:00:00,2025-09-12 16:48:00,9.8
20004226,MRF,OC-EST-MRF-AGEN-GE402,GENERADOR AUXILIAR 402 FI,MOTOR DIESEL GE-402 FASE I,42002859.0,10048492.0,R_CE,236376,m2,generador 402 presenta fuga,28/08/2025,PO-R-090,Sub. Refrigeración,R095,Tubería / Válvulas,SA-R-CE,STD1,"Daño material, grietas, desgaste, corr.",C540,1,Causa Desconocida,generador 402 presenta fuga,12/09/2025,7:00:00,12/09/2025,10:30:00,X,"3,5",MECE ORAS,2,2025-09-12 07:00:00,2025-09-12 10:30:00,3.5
20027418,CVA,OC-TER-CVA-SCTR-RAC,RACK DE CONTROL,SISTEMA DE CONTROL TANK RADAR,,10048593.0,S_CU,236508,m2,falla comunicación tank master,3/10/2025,PO-S-170,Sub. Software de control y monitoreo,S173,Equipo Computo,SA-S-CU,FTF4,Falla de Control,,0,,nan,12/09/2025,18:00:00,,0:00:00,X,0,METR ORAS,,2025-09-12 18:00:00,,0.0
20016418,CVA,OC-TER-CVA-UENF-PQ42020,PAQUETE DE ENFRIAMIENTO VFD42020,AIRE AC SPLIT/VENT PQE A VFD42020,42005047.0,10048238.0,U_AI,236121,m2,falla paquete aa vfd-42020,21/06/2025,PO-U-010,Sub. Aire Acondicionado,U010,Compresor,SA-U-AI,FTF1,No resp bajo demanda o señal en emerg.,C340,1,Desgaste normal del equipo,falla paquete aa vfd-42020,11/09/2025,8:00:00,11/09/2025,17:00:00,X,9,MECE ORAS,2,2025-09-11 08:00:00,2025-09-11 17:00:00,9.0
20021069,GRA,OC-EST-GRA-AELE-MTGE,SISTEMA MEDIA TENSIÓN GENERACION,CENTRO CTRL MOTORES GENERACION,42004822.0,10047747.0,Z_XXXX,235590,m2,perdida de com.  celda 6.9 kv  e-house,9/02/2025,PO-E-020,Sub. Control y monitoreo / Protección,E026,Protecciones Eléctricas,SA-E-SG,AIR1,"Falsa alarma, indic. defectuosa de inst.",,0,,nan,10/09/2025,7:00:00,10/09/2025,17:00:00,X,10,MECE ORAS,3,2025-09-10 07:00:00,2025-09-10 17:00:00,10.0
20021069,GRA,OC-EST-GRA-AELE-MTGE,SISTEMA MEDIA TENSIÓN GENERACION,CENTRO CTRL MOTORES GENERACION,42004822.0,10047633.0,Z_XXXX,235431,m2,perdida de com. interup.  6.9 kv e-house,29/12/2024,PO-E-060,Sub. Bus DC,E066,Interruptor,SA-E-MC,AIR1,"Falsa alarma, indic. defectuosa de inst.",,0,,nan,9/09/2025,8:00:00,9/09/2025,16:00:00,X,8,MECE ORAS,3,2025-09-09 08:00:00,2025-09-09 16:00:00,8.0
20003398,EPO,OC-EST-EPO-ACOM-MZ,CRUDO MEZCLA TRATADA (D),TANQUE CRUDO TC310,45003329.0,10048161.0,I_TA,236035,m2,"humedecimiento crudo v/v 4""x150",29/05/2025,PO-I-020,Sub. Externo,I027,Tubería / Válvulas,SA-I-TA,SER1,Piezas Mecánicas Sueltas,C340,1,Desgaste normal del equipo,se evidencia humedad,8/09/2025,11:30:00,8/09/2025,17:00:00,X,"5,5",MECE ORAS,2,2025-09-08 11:30:00,2025-09-08 17:00:00,5.5
20022014,MRF,OC-EST-MRF-SCIN-DT,DETECTORES CONTRAINCENDIOS,PANEL SCI MONITOREADO_AREA 05,,10048489.0,S_FD,236400,m2,fare y gas sistema sin comunicaciones,3/09/2025,PO-S-010,Sub. Control y monitoreo,S013,Circuitos o Componentes electrónicos,SA-S-FD,AIR2,Equipos FireFalsa alarma e indicación Gas - Detecc.,C540,1,Causa Desconocida,fare y gas sistema sin comunicaciones,8/09/2025,8:00:00,8/09/2025,16:00:00,X,8,MECE ORAS,4,2025-09-08 08:00:00,2025-09-08 16:00:00,8.0
20003005,EPO,OC-EST-EPO-PALM-CPAL,CONEXIÓN ALMACENAMIENTO,TRANSMISOR FLUJO 14 LINEA TANQUES,,10048522.0,S_IN,236406,m2,falla estado valvula  pv-250114-a,7/09/2025,PO-S-010,Sub. Control y monitoreo,S017,Unidad Central de Proceso (CPU),SA-S-IN,FTF2,No resp bajo demanda o señal en Operac,,0,,nan,7/09/2025,13:00:20,,0:00:00,X,0,METR ORAS,2,2025-09-07 13:00:20,,0.0
20010472,EPO,OC-EST-EPO-ACOM-SEII,SEPARADOR CRUDO PRINCIPAL FASE II,MODULO SEP CENTRIF. FASE II PRINCIPAL,45002721.0,10048524.0,R_MS,236407,m2,separador b-alta cte alfa laval 52300,7/09/2025,PO-R-030,Sub. Control y Monitoreo,R030,Cableado y Caja de Conexiones,SA-R-MS,AIR1,"Falsa alarma, indicador defectuoso.",,0,,nan,7/09/2025,17:42:11,,0:00:00,X,0,METR ORAS,1,2025-09-07 17:42:11,,0.0
20018186,VSA,OC-EST-VSA-SALV-PR,ALIVIO PRESIÓN,VALVULA SEG ALIV 370002,42003694.0,10048488.0,S_VS,236401,m2,falla  psv 370002,4/09/2025,PO-S-060,Sub. Válvulas,S062,Bridas,SA-S-VS,INP1,Pase interno,C340,1,Desgaste normal del equipo,desgaste componentes,4/09/2025,7:00:00,4/09/2025,11:00:00,X,4,METR ORAS,4,2025-09-04 07:00:00,2025-09-04 11:00:00,4.0
20002147,EPO,OC-EST-EPO-SALV-TQ301,TANQUE RELEVO ALIVIO TQ301,TANQUE RELEVO TR301,45006301.0,10048158.0,I_TA,236041,m2,filtro contaminado transferencia tr-301,31/05/2025,PO-I-010,Sub. Estructura e Internos,I014,Filtro / Elemento Filtrante,SA-I-TA,PLU3,Obstrucción Tubería por Agente Interno,C340,1,Desgaste normal del equipo,filtro contaminado transferencia tr-301,3/09/2025,7:00:00,3/09/2025,17:00:00,X,10,MECE ORAS,4,2025-09-03 07:00:00,2025-09-03 17:00:00,10.0
20022954,CQO,OC-EST-CQO-AELE-BTGE,SISTEMA ELECT BAJA TENSION GENERACION,CELDA 901+01 AUXILIAR BAJA,,10048487.0,Z_XXXX,236399,m2,falla totaliz backfeeder eb05-901+02.25,3/09/2025,ESIL,Interruptor de Baja Tensión,240,Interruptor,SA-E-SE,FOV1,Voltaje salida equivocado o inestable,,0,,nan,3/09/2025,9:32:39,,0:00:00,X,0,METR ORAS,1,2025-09-03 09:32:39,,0.0
20001418,VSA,OC-EST-VSA-PDES-TG83000,TRAMPA DESPACHO TG83000,TRAMPA DESPACHO VASCONIA,45004599.0,10048446.0,I_VE,236354,m2,bandeja porta raspador deteriorada,24/08/2025,PO-I-020,Sub. Externo,I026,Pedestal / Soporte,SA-I-VE,STD1,"Daño material, grietas, desgaste, corr.",C340,1,Desgaste normal del equipo,desgaste componentes,2/09/2025,8:00:00,2/09/2025,9:00:00,X,1,MECE ORAS,2,2025-09-02 08:00:00,2025-09-02 09:00:00,1.0
20001418,VSA,OC-EST-VSA-PDES-TG83000,TRAMPA DESPACHO TG83000,TRAMPA DESPACHO VASCONIA,45004599.0,10048441.0,I_VE,236352,m2,cabrestante y trole trampa atascados,24/08/2025,PO-I-010,Sub. Estructura e Internos,I015,Pedestal / Soporte,SA-I-VE,STD1,"Daño material, grietas, desgaste, corr.",C340,1,Desgaste normal del equipo,desgaste componentes,2/09/2025,8:00:00,2/09/2025,9:00:00,X,1,MECE ORAS,2,2025-09-02 08:00:00,2025-09-02 09:00:00,1.0
20005459,CVA,OC-TER-CVA-SALV-TR,ALIVIO TRANSIENTE,VALVULA SEG ALIV TRANSI DESPACHO,45005666.0,10048512.0,S_VS,236397,m2,fallas baja presion danflo 820014b,2/09/2025,PO-S-010,Sub. Control y monitoreo,S014,Indicador o Sensor,SA-S-VS,ELP1,Fuga externa de aire - Fluido de Proceso,,0,,nan,2/09/2025,7:05:07,,0:00:00,X,0,METR ORAS,4,2025-09-02 07:05:07,,0.0
20015679,EPO,OC-EST-EPO-UENF-PQBT,PAQUETE ENFRIAMIENTO BAJA TENSION,AIRE AC SPLIT/VENT PQE BAJA TENSION 3,42005371.0,10048220.0,U_AI,236053,m2,falla aiere acondicionado ac920-50600c,3/06/2025,PO-U-010,Sub. Aire Acondicionado,U010,Compresor,SA-U-AI,FTF1,No resp bajo demanda o señal en emerg.,,0,,nan,1/09/2025,7:00:00,2/09/2025,17:00:00,X,34,MECE ORAS,2,2025-09-01 07:00:00,2025-09-02 17:00:00,
20001360,VSA,OC-EST-VSA-ADRE-DC,DRENAJE CERRADO,BOMBA ACHIQUE TU-53010,,10048409.0,R_PU,236308,m2,vibrac-ruido anorm. en bom. sum. bu53030,9/08/2025,PO-R-010,Sub. Transmisión,R013,Rodamientos,SA-R-PU,VIB1,Vibración anormal,,0,,nan,31/08/2025,10:00:00,31/08/2025,21:00:00,X,11,MECE ORAS,2,2025-08-31 10:00:00,2025-08-31 21:00:00,
20001358,VSA,OC-EST-VSA-ADRE-DC,DRENAJE CERRADO,TRANSMISOR NIVEL B DC TU-53010,,10048481.0,S_IN,236391,m2,falla swicth bajo nivel,31/08/2025,PO-S-010,Sub. Control y monitoreo,S014,Indicador o Sensor,SA-S-IN,FTF2,No resp bajo demanda o señal en Operac,C310,1,Operación Fuera de parámetros,fallo intermitente  transmisor de nivel,31/08/2025,10:30:00,31/08/2025,21:30:00,X,11,MECE ORAS,4,2025-08-31 10:30:00,2025-08-31 21:30:00,
20007930,VSA,OC-EST-VSA-PMED-BE3630,BRAZO MEDICIÓN DE ENTRADA BE3630,ACTUADOR MOV-3632 DE BRAZO MEDICION 3630,,10048482.0,Z_XXXX,236380,m2,falla actuador mecanico mov 3632 ms 3600,29/08/2025,ADME,Actuador Mecánico,4,Acople Bastago,SA-S-VA,FTO1,No abre cuando se da la orden,C340,1,Desgaste normal del equipo,deterioro componentes,30/08/2025,14:00:00,30/08/2025,17:00:00,X,3,MECE ORAS,1,2025-08-30 14:00:00,2025-08-30 17:00:00,3.0
20001643,VSA,OC-EST-VSA-PMED-BE3650,BRAZO MEDICIÓN DE ENTRADA BE3650,TRANSMISOR TEMPERATURA BRAZO MED 50,,10048451.0,S_IN,236372,m2,falla bz #5 ms-3600 oscil transm tempera,27/08/2025,PO-S-010,Sub. Control y monitoreo,S014,Indicador o Sensor,SA-S-IN,ERO3,Señal errática,C340,1,Desgaste normal del equipo,desgaste componentes,29/08/2025,16:00:00,29/08/2025,21:30:00,X,"5,5",MECE ORAS,2,2025-08-29 16:00:00,2025-08-29 21:30:00,5.5
20001656,VSA,OC-EST-VSA-PMED-BE3660,BRAZO MEDICIÓN DE ENTRADA BE3660,TRANSMISOR PRES DIFER MED TFL-3660,,10048484.0,S_IN,236373,m2,falla bz #6 ms-3600 oscil transm presion,27/08/2025,PO-S-010,Sub. Control y monitoreo,S014,Indicador o Sensor,SA-S-IN,ERO3,Señal errática,C340,1,Desgaste normal del equipo,sulfatacion en bornes,29/08/2025,13:00:00,29/08/2025,15:00:00,X,2,MECE ORAS,2,2025-08-29 13:00:00,2025-08-29 15:00:00,2.0
20001657,VSA,OC-EST-VSA-PMED-BE3660,BRAZO MEDICIÓN DE ENTRADA BE3660,TRANSMISOR FLUJO BRAZO MED 60,,10048483.0,S_IN,236374,m2,falla bz #6 ms-3600 oscil transm flujo,27/08/2025,PO-S-010,Sub. Control y monitoreo,S014,Indicador o Sensor,SA-S-IN,ERO3,Señal errática,C340,1,Desgaste normal del equipo,señal intermitente,29/08/2025,10:00:00,29/08/2025,12:00:00,X,2,MECE ORAS,3,2025-08-29 10:00:00,2025-08-29 12:00:00,2.0
20010439,EPO,OC-EST-EPO-ACOM-MZ1,CRUDO MEZCLA,TANQUE CRUDO TC52080,45006359.0,70021120.0,I_TA,236390,m2,tc52080 fuga junta bridada expasion term,30/08/2025,PO-I-070,Sub. Misceláneos,I071,Brida / Junta Bridada,SA-I-TA,ELP2,Fuga externa crudo - Fluido Proceso,,0,,nan,29/08/2025,11:25:19,,0:00:00,X,0,MECE ORAS,2,2025-08-29 11:25:19,,0.0
20015450,GRA,OC-EST-GRA-AGEN-GE22020,GENERADOR PRINCIPAL 20,TURBINA DE POTENCIA GAS GE20,42003393.0,10048248.0,R_ST,236122,m2,disparo turb alta vibracion ud13x1,23/06/2025,PO-R-030,Sub. Control y Monitoreo,R030,Cableado y Caja de Conexiones,SA-R-ST,AIR1,"Falsa alarma, indicador defectuoso.",,0,,nan,28/08/2025,0:01:00,28/08/2025,4:30:00,X,"4,48",MECE ORAS,3,2025-08-28 00:01:00,2025-08-28 04:30:00,4.48
20015450,GRA,OC-EST-GRA-AGEN-GE22020,GENERADOR PRINCIPAL 20,TURBINA DE POTENCIA GAS GE20,42003393.0,,R_ST,236379,m2,disparo turb ge-20 alta vibracion ud13x1,2/08/2025,PO-R-030,Sub. Control y Monitoreo,R034,Unidad de Control,SA-R-ST,AIR1,"Falsa alarma, indicador defectuoso.",,0,,nan,28/08/2025,1:00:04,,0:00:00,X,0,MECE,3,2025-08-28 01:00:04,,0.0
20015450,GRA,OC-EST-GRA-AGEN-GE22020,GENERADOR PRINCIPAL 20,TURBINA DE POTENCIA GAS GE20,42003393.0,,R_ST,236379,m2,disparo turb ge-20 alta vibracion ud13x1,2/08/2025,PO-R-030,Sub. Control y Monitoreo,R034,Unidad de Control,SA-R-ST,AIR1,"Falsa alarma, indicador defectuoso.",,0,,nan,28/08/2025,1:00:04,,0:00:00,X,0,MECE,3,2025-08-28 01:00:04,,0.0
20015450,GRA,OC-EST-GRA-AGEN-GE22020,GENERADOR PRINCIPAL 20,TURBINA DE POTENCIA GAS GE20,42003393.0,10048461.0,R_ST,236382,m2,disparo turbge-20 alta vibracion ud13x1,2/08/2025,PO-R-030,Sub. Control y Monitoreo,R034,Unidad de Control,SA-R-ST,AIR1,"Falsa alarma, indicador defectuoso.",,0,,nan,28/08/2025,1:01:04,,0:00:00,X,0,METR ORAS,3,2025-08-28 01:01:04,,0.0
20001418,VSA,OC-EST-VSA-PDES-TG83000,TRAMPA DESPACHO TG83000,TRAMPA DESPACHO VASCONIA,45004599.0,10048445.0,I_VE,236353,m2,venteos y drenajes mal diseñados e insta,24/08/2025,PO-I-010,Sub. Estructura e Internos,I019,Tubería / Válvulas,SA-I-VE,ELP2,Fuga externa crudo - Fluido Proceso,C320,1,Error de Operación,rebose drenaje trampa,28/08/2025,8:00:00,28/08/2025,9:00:00,X,1,MECE ORAS,2,2025-08-28 08:00:00,2025-08-28 09:00:00,1.0
20027410,VSA,OC-EST-VSA-SCTR-RAC,RACK DE CONTROL,SISTEMA DE CONTROL MASTER STATION 36/37K,,10048444.0,S_CU,236350,m2,perdida de estado valv y equipos del sis,24/08/2025,PO-S-010,Sub. Control y monitoreo,S017,Unidad Central de Proceso (CPU),SA-S-CU,FTF2,No resp bajo demanda o señal en Operac,C320,1,Error de Operación,apertura de interruptor en ccm,28/08/2025,14:00:00,28/08/2025,17:00:00,X,3,MECE ORAS,4,2025-08-28 14:00:00,2025-08-28 17:00:00,3.0
20008837,EPO,OC-EST-EPO-PMED-BE38040,BRAZO MEDICIÓN DE ENTRADA ALEPO 40,PI-380401 INDICADOR PRESIÓN BRAZO 4,,10048455.0,Z_XXXX,236377,m2,falla transm de presion brazo #4 pat.adp,28/08/2025,IPDP,"Transmisor de Presión, diferencial",296,modulo electronica,SA-S-AM,FTF4,Falla de Control,,0,,nan,28/08/2025,10:38:32,,0:00:00,X,0,METR ORAS,1,2025-08-28 10:38:32,,0.0
20001415,VSA,OC-EST-VSA-PREC-TG23000,TRAMPA RECIBO TG23000,TRAMPA RECIBO LA BELLEZA-VASCONIA,45004603.0,10048440.0,I_VE,236355,m2,venteos y drenajes mal diseñados e insta,24/08/2025,PO-I-020,Sub. Externo,I023,Drenaje,SA-I-VE,ELP2,Fuga externa crudo - Fluido Proceso,C340,1,Desgaste normal del equipo,enteos y drenajes mal diseñados e insta,27/08/2025,13:00:00,27/08/2025,14:00:00,X,1,METR ORAS,2,2025-08-27 13:00:00,2025-08-27 14:00:00,1.0
20001415,VSA,OC-EST-VSA-PREC-TG23000,TRAMPA RECIBO TG23000,TRAMPA RECIBO LA BELLEZA-VASCONIA,45004603.0,10048439.0,I_VE,236356,m2,bandeja porta raspador deteriorada,24/08/2025,PO-I-020,Sub. Externo,I024,Escalera / Pasarela / Plataforma,SA-I-VE,STD1,"Daño material, grietas, desgaste, corr.",C340,1,Desgaste normal del equipo,desgaste componentes,27/08/2025,11:00:00,27/08/2025,12:00:00,X,1,MECE ORAS,2,2025-08-27 11:00:00,2025-08-27 12:00:00,1.0
20005308,CVA,OC-TER-CVA-ADRE-DC,DRENAJE CERRADO,BOMBA REINYECCION DC TU-53100,42005055.0,10048510.0,R_PU,236368,m2,falla bomba sumergible trampa ccm2,27/08/2025,PO-R-020,Sub. Lubricación,R022,Bomba,SA-R-PU,STD1,"Daño material, grietas, desgaste, corr.",,0,,nan,27/08/2025,9:29:07,,0:00:00,X,0,METR ORAS,1,2025-08-27 09:29:07,,0.0
20005319,CVA,OC-TER-CVA-ADRE-DC,DRENAJE CERRADO,BOMBA CENTRIFUGA REINYECCION DC TU-59000,42005056.0,10048511.0,R_PU,236370,m2,falla bomba sumergible bumker despacho,27/08/2025,PO-R-020,Sub. Lubricación,R022,Bomba,SA-R-PU,STD1,"Daño material, grietas, desgaste, corr.",,0,,nan,27/08/2025,10:09:27,,0:00:00,X,0,METR ORAS,1,2025-08-27 10:09:27,,0.0
20005354,CVA,OC-TER-CVA-AGEN-GE22030,GENERADOR AUXILIAR 30,GENERADOR 30 0.48kV,45005743.0,20194988.0,R_EG,236366,m2,falla de sincronizacion del gen 22030,27/08/2025,PO-S-030,Sub. Suministro de Energía,S033,Fuente de Alimentación,SA-S-IN,DOP1,Señal retardada,,0,,nan,27/08/2025,5:25:20,,0:00:00,X,0,MECE ORAS,3,2025-08-27 05:25:20,,0.0
20018443,EPO,OC-EST-EPO-ACOM-MZ1,CRUDO MEZCLA,TANQUE AGUA CCS52200,45006361.0,10048457.0,I_TA,236367,m2,falla swich tq odos alfa laval 52300,27/08/2025,PO-I-040,Sub. Control y Monitoreo,I043,Monitoreo (PLC - Tarjetas - sensores),SA-I-TA,AIR1,"Falsa alarma, indic. defectuosa de inst.",C340,1,Desgaste normal del equipo,alto nivel de lodos,27/08/2025,13:00:00,27/08/2025,16:00:00,X,3,METR ORAS,1,2025-08-27 13:00:00,2025-08-27 16:00:00,3.0
20023716,EPO,OC-EST-EPO-SCTR-DCS,DCS CONTROL,CONTROLADOR RESERVA,45006338.0,,S_CL,236369,m2,falla valvula apertura dra,27/08/2025,PO-I-040,Sub. Control y Monitoreo,I040,Cableado y Caja de Conexiones,SA-E-PC,AIR1,"Falsa alarma, indic. defectuosa de inst.",,0,,nan,27/08/2025,10:06:26,,0:00:00,X,0,MEAB,4,2025-08-27 10:06:26,,0.0
20027487,CVA,OC-TER-CVA-ADRE-DA,DRENAJE ABIERTO,BOMBA CENTRIFUGA 2 ODC TK73,,10047909.0,R_PU,235746,m2,bomba bunker esdv-8100024 atascada,14/03/2025,PO-R-040,Sub. Bombeo - Mezcla Fluidos,R040,Impulsor,SA-R-PU,PLU2,Obstrucción filtro de Succión,C340,1,Desgaste normal del equipo,bomba bunker esdv-8100024 atascada,26/08/2025,9:00:00,26/08/2025,11:00:00,X,2,MECE ORAS,2,2025-08-26 09:00:00,2025-08-26 11:00:00,2.0
20002776,EPO,OC-EST-EPO-SCIN-ES,ESPUMA CONTRAINCENDIOS,VALVULA DE DILUVIO DV-572001,,10048327.0,S_FE,236182,m2,fuga agua dv-572001 linea br-bpc,12/07/2025,PO-S-060,Sub. Válvulas,S067,Sellos,SA-S-FE,FTF1,Equipos FireNo resp bajo demanda o señal en emerg. Gas- Extinción,C340,1,Desgaste normal del equipo,fuga agua dv-572001 linea br-bpc,26/08/2025,10:00:00,26/08/2025,11:00:00,X,1,MECE ORAS,1,2025-08-26 10:00:00,2025-08-26 11:00:00,1.0
20017615,EPO,OC-EST-EPO-PMED-CA37010,MEDICIÓN CALIDAD CA37010,TOMAMUESTRAS CALIDAD 37,,10047701.0,S_IN,236364,m2,falla tomamuetras patin araguaney,26/08/2025,PO-S-010,Sub. Control y monitoreo,S017,Unidad Central de Proceso (CPU),SA-S-CL,FTF4,Falla de Control,,0,,nan,26/08/2025,16:25:20,,0:00:00,X,0,METR ORAS,2,2025-08-26 16:25:20,,0.0
20001599,VSA,OC-EST-VSA-PMED-BE3620,BRAZO MEDICIÓN DE ENTRADA BE3620,VALVULA MOV_8X600- MUL 220-BE3620,45004398.0,10048442.0,S_VA,236316,m2,pase en válvula mov-3621,13/08/2025,PO-S-060,Sub. Válvulas,S063,Cuerpo de la Válvula,SA-S-VA,INP1,Pase interno,C340,1,Desgaste normal del equipo,desgaste componentes,25/08/2025,8:00:00,25/08/2025,9:00:00,X,1,MECE ORAS,2,2025-08-25 08:00:00,2025-08-25 09:00:00,1.0
20021545,PAE,OC-EST-PAE-UENF-PQVF,AIRES PAQUETE SHELTER DE VFD,AIRE AC PQE #4 SHELTER VFD,42004563.0,10048434.0,U_AI,236360,m2,falla paquete d refrigeracion vfd,25/08/2025,PO-U-010,Sub. Aire Acondicionado,U010,Compresor,SA-U-AI,FTF1,No resp bajo demanda o señal en emerg.,,0,,nan,25/08/2025,15:29:49,,0:00:00,X,0,METR ORAS,2,2025-08-25 15:29:49,,0.0
20001512,VSA,OC-EST-VSA-PMED-BS37030,BRAZO MEDICIÓN SALIDA BS37030,TRANSMISOR TEMPERATURA BRAZO MED 37030,,10048437.0,S_IN,236359,m2,falla trasm. de temperatura brazo 37030,25/08/2025,PO-S-010,Sub. Control y monitoreo,S013,Circuitos o Componentes electrónicos,SA-S-IN,ERO3,Señal errática,C310,1,Operación Fuera de parámetros,fluctuacion al recibir movimiento,25/08/2025,14:00:00,25/08/2025,16:00:00,X,2,MECE ORAS,2,2025-08-25 14:00:00,2025-08-25 16:00:00,2.0
20021220,GRA,OC-EST-GRA-AGEN-GE22020,GENERADOR PRINCIPAL 20,TURBINA COMPRESORA,,10048435.0,R_ST,236363,m2,falla tge-20 señal feedback abierta,26/08/2025,PO-R-060,Sub. Escape,R063,Tubería / Válvulas,SA-S-VS,AIR2,Falsa alarma e indicación,,0,,nan,25/08/2025,15:00:00,25/08/2025,22:00:00,X,7,MECE ORAS,1,2025-08-25 15:00:00,2025-08-25 22:00:00,7.0
20001573,VSA,OC-EST-VSA-PMED-CA3600,MEDICIÓN CALIDAD CA3600,TOMAMUESTRAS MS-3600,45004561.0,10048438.0,S_IN,236351,m2,falla equipo llena toma muestra rapido,24/08/2025,PO-S-120,Sub. Misceláneos,S128,Tubería / Válvulas,SA-S-IN,FTF2,No resp bajo demanda o señal en Operac,,0,,nan,24/08/2025,14:05:03,,0:00:00,X,0,METR ORAS,2,2025-08-24 14:05:03,,0.0
20023643,EPO,OC-EST-EPO-PDES-LI,LINEA DESPACHO,LINEA DESPACHO A EST PAEZ,,10048548.0,I_PI,236347,m2,falla bomba sistema dra,23/08/2025,PO-I-070,Sub. Misceláneos,I072,Protección Contra Rayos,SA-I-PI,PLU3,Obstrucción Tubería por Agente Interno,,0,,nan,23/08/2025,14:52:46,,0:00:00,X,0,METR ORAS,2,2025-08-23 14:52:46,,0.0
20004759,CVA,OC-TER-CVA-PALM-TK12020,TANQUE DE ALMACENAMIENTO TK12020,TANQUE ALMAC CRUDO TK12020,45005281.0,10048506.0,I_TA,236342,m2,valvula anillo refrigeracion tk-12020,22/08/2025,PO-E-110,Sub. Refrigeración,E115,Válvulas,SA-S-VS,ELP4,Fuga externa de Agua -Fluido de Proceso,,0,,nan,22/08/2025,18:16:54,,0:00:00,X,0,METR ORAS,3,2025-08-22 18:16:54,,0.0
20004759,CVA,OC-TER-CVA-PALM-TK12020,TANQUE DE ALMACENAMIENTO TK12020,TANQUE ALMAC CRUDO TK12020,45005281.0,70019389.0,I_TA,236343,m2,fuga aire  contraincendios tk 12020,22/08/2025,PO-R-060,Sub. Escape,R062,Conductos,SA-I-TA,ELP1,Fuga externa de aire - Fluido de Proceso,,0,,nan,22/08/2025,20:52:29,,0:00:00,X,0,METR ORAS,3,2025-08-22 20:52:29,,0.0
20004759,CVA,OC-TER-CVA-PALM-TK12020,TANQUE DE ALMACENAMIENTO TK12020,TANQUE ALMAC CRUDO TK12020,45005281.0,10048505.0,I_TA,236341,m2,hv drenaje dique agua lluvia tk-12020,22/08/2025,PO-R-020,Sub. Lubricación,R028,Tubería / Válvulas,SA-S-VM,PLU7,Atascamiento,,0,,nan,22/08/2025,18:10:42,,0:00:00,X,0,METR ORAS,3,2025-08-22 18:10:42,,0.0
20004774,CVA,OC-TER-CVA-PALM-TK12010,TANQUE DE ALMACENAMIENTO TK12010,TANQUE ALMAC CRUDO TK12010,45005273.0,10048507.0,I_TA,236340,m2,hv drenaje dique agua lluvia tk-12010,22/08/2025,PO-S-060,Sub. Válvulas,S065,Elemento de cierre,SA-S-VM,INP1,Pase interno,,0,,nan,22/08/2025,18:02:39,,0:00:00,X,0,METR ORAS,3,2025-08-22 18:02:39,,0.0
20004833,CVA,OC-TER-CVA-PALM-TK7313,TANQUE DE ALMACENAMIENTO TK7313,TANQUE ALMAC NAFTA TK7313,45005405.0,10048508.0,I_TA,236345,m2,falla hv aguas aceitosas tk 7313,22/08/2025,PO-S-060,Sub. Válvulas,S063,Cuerpo de la Válvula,SA-S-VM,STD1,"Daño material, grietas, desgaste, corr.",,0,,nan,22/08/2025,22:36:54,,0:00:00,X,0,METR ORAS,3,2025-08-22 22:36:54,,0.0
20004854,CVA,OC-TER-CVA-PALM-TK7312,TANQUE DE ALMACENAMIENTO TK7312,TANQUE ALMAC CRUDO TK7312,45005316.0,10048509.0,I_TA,236344,m2,falla hv aguas aceitosas tk 7312,22/08/2025,PO-S-060,Sub. Válvulas,S065,Elemento de cierre,SA-S-VM,FTO1,No abre cuando se da la orden,,0,,nan,22/08/2025,21:00:26,,0:00:00,X,0,METR ORAS,3,2025-08-22 21:00:26,,0.0
20010441,EPO,OC-EST-EPO-ACOM-MZ1,CRUDO MEZCLA,TRANSMISOR NIVEL TC52080,,10048348.0,S_IN,236228,m2,falla transmisor de nivel tc-52080,24/07/2025,PO-S-010,Sub. Control y monitoreo,S014,Indicador o Sensor,SA-S-IN,ERO3,Señal errática,C340,1,Desgaste normal del equipo,el transmisor entraba en condición de fa,19/08/2025,7:00:00,19/09/2025,17:00:00,X,754,METR ORAS,4,2025-08-19 07:00:00,2025-09-19 17:00:00,
20003000,EPO,OC-EST-EPO-PREC-LI,LÍNEA DE RECIBO,VALVULA SEG CONV LDS SHUTDOWN L ENT,45006053.0,10048546.0,S_VS,236330,m2,alto nivel agua sumidero esdv recibo,19/08/2025,PO-S-120,Sub. Misceláneos,S127,Tanque o Piscina,SA-S-VS,AIR2,Falsa alarma e indicación,,0,,nan,19/08/2025,7:57:43,,0:00:00,X,0,METR ORAS,4,2025-08-19 07:57:43,,0.0
20003002,EPO,OC-EST-EPO-PDES-LI,LINEA DESPACHO,VALVULA LDS SHUTDOWN LINEA DESPACH,45006005.0,10048547.0,S_VA,236331,m2,alto nivel agua sumidero esdv despacho,19/08/2025,PO-S-120,Sub. Misceláneos,S127,Tanque o Piscina,SA-S-VA,AIR2,Falsa alarma e indicación,,0,,nan,19/08/2025,8:06:05,,0:00:00,X,0,METR ORAS,4,2025-08-19 08:06:05,,0.0
20015590,EPO,OC-EST-EPO-AELE-BTBOM,BAJA TENSIÓN - DEPURAR,TABLERO FUERZA ILUMINACION EXTERNA,42005358.0,10048425.0,E_EP,236332,m2,falla iluminacion perimetral,19/08/2025,PO-E-010,Sub. Circuito Alimentación,E014,Interruptor,SA-E-EP,STD1,"Daño material, grietas, desgaste, corr.",,0,,nan,19/08/2025,19:24:32,,0:00:00,X,0,METR ORAS,2,2025-08-19 19:24:32,,0.0
20023774,EPO,OC-EST-EPO-AGEN-GE22130,GENERADOR PRINCIPAL 30,TURBINA GAS MULTIET. GE30 7.9 MW,42004252.0,,R_ST,236327,m2,baja resolucion pantalla hmi ge 22130,18/08/2025,PO-R-030,Sub. Control y Monitoreo,R034,Unidad de Control,SA-R-ST,PDE1,Parámetro excede lim. superior/inferior,,0,,nan,18/08/2025,14:48:56,,0:00:00,,0,METR,3,2025-08-18 14:48:56,,0.0
20016432,CQO,OC-EST-CQO-AGEN-GE22030,GENERADOR PRINCIPAL 30,GENERADOR ELECT 30 de   6.9kV,42003452.0,10048420.0,R_EG,236323,m2,falla baterias tablero control gn30,16/08/2025,PO-R-030,Sub. Control y Monitoreo,R034,Unidad de Control,SA-R-EG,AIR1,"Falsa alarma, indicador defectuoso.",,0,,nan,16/08/2025,14:04:55,,0:00:00,X,0,METR ORAS,3,2025-08-16 14:04:55,,0.0
20004219,MRF,OC-EST-MRF-AGEN-GE522020,GENERADOR AUXILIAR 20 FII,GENERADOR AUXILIAR 20 FII,45004851.0,10047661.0,R_EG,235491,m2,falla corto circuito generado 2 fase ii,16/01/2025,PO-R-100,Sub. Generador Eléctrica,R101,Estator,SA-R-EG,STD1,"Daño material, grietas, desgaste, corr.",C540,1,Causa Desconocida,falla corto circuito generado 2 fase ii,15/08/2025,7:00:00,15/08/2025,17:30:00,X,"10,5",MECE ORAS,1,2025-08-15 07:00:00,2025-08-15 17:30:00,10.5
20023181,CQO,OC-EST-CQO-AAGU-PO,SISTEMA DE RECIBO AGUA POTABLE,BOMBA DOSIFICA CLORO #1,42004507.0,10048416.0,R_PU,236319,m2,falla bomba docificadora #1,15/08/2025,PO-R-040,Sub. Bombeo - Mezcla Fluidos,R042,Diafragma,SA-R-PU,STD1,"Daño material, grietas, desgaste, corr.",,0,,nan,15/08/2025,15:32:12,,0:00:00,X,0,METR ORAS,1,2025-08-15 15:32:12,,0.0
20023182,CQO,OC-EST-CQO-AAGU-PO,SISTEMA DE RECIBO AGUA POTABLE,BOMBA DOSIFICA CLORO #2,42004508.0,10048417.0,R_PU,236320,m2,falla bomba dosificadora #2,15/08/2025,PO-R-040,Sub. Bombeo - Mezcla Fluidos,R042,Diafragma,SA-R-PU,STD1,"Daño material, grietas, desgaste, corr.",,0,,nan,15/08/2025,15:37:48,,0:00:00,X,0,METR ORAS,1,2025-08-15 15:37:48,,0.0
20023774,EPO,OC-EST-EPO-AGEN-GE22130,GENERADOR PRINCIPAL 30,TURBINA GAS MULTIET. GE30 7.9 MW,42004252.0,,R_ST,236311,m2,falla toma 480v equipo de lavado ge22130,10/08/2025,PO-R-140,Sub. Inyección Agua/Vapor,R141,Cableado y Caja de Conexiones,SA-R-ST,STD1,"Daño material, grietas, desgaste, corr.",,0,,nan,10/08/2025,16:56:35,,0:00:00,X,0,METR,3,2025-08-10 16:56:35,,0.0
20015450,GRA,OC-EST-GRA-AGEN-GE22020,GENERADOR PRINCIPAL 20,TURBINA DE POTENCIA GAS GE20,42003393.0,10048410.0,R_ST,236310,m2,disparo2turb 20 por bov1 posicion maxima,10/08/2025,PO-R-030,Sub. Control y Monitoreo,R030,Cableado y Caja de Conexiones,SA-R-ST,AIR1,"Falsa alarma, indicador defectuoso.",,0,,nan,10/08/2025,4:34:53,,0:00:00,X,0,METR ORAS,3,2025-08-10 04:34:53,,0.0
20001633,VSA,OC-EST-VSA-PMED-BE3640,BRAZO MEDICIÓN DE ENTRADA BE3640,VALVULA MOV_8X600- MUL 220-BE3640,45004409.0,70020974.0,S_VA,236307,m2,goteo en vastago mov 3642 brazo 4 ms3600,9/08/2025,PO-S-060,Sub. Válvulas,S068,Vástago,SA-S-VA,ELP2,Fuga externa crudo - Fluido Proceso,,0,,nan,9/08/2025,16:45:36,,0:00:00,X,0,METR ORAS,2,2025-08-09 16:45:36,,0.0
20001697,VSA,OC-EST-VSA-PMED-BE3680,BRAZO MEDICIÓN DE ENTRADA BE3680,VALVULA MOV_8X600- MUL 220-BE3680,45004430.0,70020973.0,S_VA,236306,m2,goteo en vastago mov 3682 brazo 8 ms3600,9/08/2025,PO-S-060,Sub. Válvulas,S068,Vástago,SA-S-VA,ELP2,Fuga externa crudo - Fluido Proceso,,0,,nan,9/08/2025,16:36:33,,0:00:00,X,0,MECE ORAS,2,2025-08-09 16:36:33,,0.0
20001697,VSA,OC-EST-VSA-PMED-BE3680,BRAZO MEDICIÓN DE ENTRADA BE3680,VALVULA MOV_8X600- MUL 220-BE3680,45004430.0,70020973.0,S_VA,236305,m2,goteo en vastago mov 3682 brazo 2 ms3600,9/08/2025,PO-S-060,Sub. Válvulas,S068,Vástago,SA-S-VA,ELP2,Fuga externa crudo - Fluido Proceso,,0,,nan,9/08/2025,16:17:31,,0:00:00,X,0,MECE ORAS,2,2025-08-09 16:17:31,,0.0
20013868,EPO,OC-EST-EPO-AGEN-GE22070,GENERADOR PRINCIPAL 70,TURBINA GAS GE70 3.8 MW,45006451.0,10048363.0,R_ST,236248,m2,salida tg70 por apertura k05,31/07/2025,PO-R-030,Sub. Control y Monitoreo,R030,Cableado y Caja de Conexiones,SA-R-ST,ERO2,Salida por Oscilación de Frencuencia,,0,,nan,8/08/2025,7:00:00,8/08/2025,12:00:00,X,5,MECE ORAS,3,2025-08-08 07:00:00,2025-08-08 12:00:00,5.0
20014302,CQO,OC-EST-CQO-UENF-PQVF,AIRES PAQUETE SHELTER VFD,AIRE AC PQE #2 SHELTER VFD,42004358.0,10048388.0,U_AI,236297,m2,capacitor ventilador aacon vfd en falla,8/08/2025,PO-R-080,Sub. Arranque,R081,Control de Arranque,SA-I-HE,FTS1,No arranca al momento de encender,,0,,nan,8/08/2025,11:09:43,,0:00:00,X,0,METR ORAS,2,2025-08-08 11:09:43,,0.0
20022278,VSA,OC-EST-VSA-PMED-BE3650,BRAZO MEDICIÓN DE ENTRADA BE3650,MEDIDOR FLUJO BRAZO MED BE3650,45004416.0,10048408.0,S_IN,236298,m2,golpeteo en medidor de flujo fqe-36050,8/08/2025,PO-R-030,Sub. Control y Monitoreo,R033,Sensores,SA-S-IN,ERO3,Señal errática,C340,1,Desgaste normal del equipo,golpeteo en medidor de flujo fqe-36050,8/08/2025,9:00:00,8/08/2025,12:00:00,X,3,MECE ORAS,3,2025-08-08 09:00:00,2025-08-08 12:00:00,3.0
20025957,EPO,OC-EST-EPO-UENF-CCMPRINCIPAL,PAQUETE ENFRIAMIENTO CCM PRINCIPAL,AIRE AC SPLIT/VENT PQTE A CCM PRINCIPAL,,10048396.0,U_AI,236277,m2,alta temperatura vfd-42020,6/08/2025,PO-U-010,Sub. Aire Acondicionado,U013,Unidad Condensadora,SA-U-AI,FTF1,No resp bajo demanda o señal en emerg.,C340,1,Desgaste normal del equipo,rodamientos de los motores en mal estad,7/08/2025,8:00:00,7/08/2025,14:00:00,X,6,METR ORAS,2,2025-08-07 08:00:00,2025-08-07 14:00:00,6.0
20014293,CQO,OC-EST-CQO-UENF-PQMT,AIRES PAQUETE SHELTER MEDIA TENSIÓN,AIRE AC PQE #1 SHELTER MT,42004355.0,10048387.0,U_AI,236294,m2,correa rota pqte1 aacon shelter mt,7/08/2025,PO-E-110,Sub. Refrigeración,E116,Ventiladores de Refrigeración,SA-R-BL,STD1,"Daño material, grietas, desgaste, corr.",C340,1,Desgaste normal del equipo,correa rota pqte1 aacon shelter mt,7/08/2025,9:00:00,7/08/2025,10:00:00,X,1,METR ORAS,2,2025-08-07 09:00:00,2025-08-07 10:00:00,1.0
20008874,EPO,OC-EST-EPO-PMED-CA38000,MEDICIÓN CALIDAD CA38000,TOMAMUESTRAS CALIDAD 38,,10048400.0,S_IN,236291,m2,exceso producto bomba loop calidad altos,7/08/2025,PO-S-120,Sub. Misceláneos,S127,Tanque o Piscina,SA-S-IN,SER1,Piezas Mecánicas Sueltas,C340,1,Desgaste normal del equipo,exceso producto bomba loop calidad altos,7/08/2025,0:42:12,7/08/2025,1:00:00,X,"0,3",METR ORAS,2,2025-08-07 00:42:12,2025-08-07 01:00:00,0.3
20010709,EPO,OC-EST-EPO-PMED-BE38050,BRAZO MEDICIÓN DE ENTRADA ALEPO 50,TI-380501 INDICADOR DE TEMPERATURA,,10048391.0,Z_XXXX,236265,m2,fallatransmisor de temperatura ti-380501,4/08/2025,IPTC,Termocupla,456,termopozo,SA-E-FC,FOF1,Frecuencia equivocada u oscilante,C340,1,Desgaste normal del equipo,fallatransmisor de temperatura ti-380501,6/08/2025,7:00:00,6/08/2025,17:00:00,X,10,MECE ORAS,1,2025-08-06 07:00:00,2025-08-06 17:00:00,10.0
20002899,EPO,OC-EST-EPO-AELE-BTALM,BAJA TENSIÓN ALMACENAMIENTO,AIRE ACONDICIONADO 920-AC-20400,45006372.0,10048406.0,E_EP,236302,m2,cambio compresores aacon tank farm,6/08/2025,PO-E-020,Sub. Control y monitoreo / Protección,E023,Fuente de Alimentación Interna,SA-E-EP,STD1,"Daño material, grietas, desgaste, corr.",,0,,nan,6/08/2025,11:08:45,,0:00:00,X,0,METR ORAS,2,2025-08-06 11:08:45,,0.0
20023731,EPO,OC-EST-EPO-AELE-BTBPC,BAJA TENSIÓN BOMBAS PRINCIPALES,CENTRO CONTROL MOTORES 42000 REPO,42005353.0,10048397.0,E_MC,236278,m2,falla interruptor bpc-42040,6/08/2025,PO-E-010,Sub. Circuito Alimentación,E014,Interruptor,SA-E-MC,FOV1,Voltaje salida equivocado o inestable,C340,1,Desgaste normal del equipo,falla interruptor bpc-42040,6/08/2025,9:00:00,6/08/2025,17:00:00,X,8,MECE ORAS,3,2025-08-06 09:00:00,2025-08-06 17:00:00,8.0
20027391,EPO,OC-EST-EPO-SCTR-EME,PARADA DE EMERGENCIA,SISTEMA DE CONTROL ESD-SIS,,10048414.0,S_CU,236281,m2,falla de comunicacion de la ema 600001,6/08/2025,PO-S-280,Sub. Control Actuadores,S284,Lazo de Control,SA-S-CU,AIR2,Falsa alarma e indicación,,0,,nan,6/08/2025,16:58:47,,0:00:00,X,0,METR ORAS,,2025-08-06 16:58:47,,0.0
20003443,EPO,OC-EST-EPO-ALOC-ED,EDIFICACIONES,EDIFICACION OFICINA ADMINISTRATIVAS,46000807.0,10048218.0,Z_XXXX,236095,m2,daño toma corriente oficina qumicos,15/06/2025,PO-A-020,Sub. Eléctrico e Instrumentación,A022,Acometida eléctrica,SA-S-CL,FTF3,"No resp bajo demanda, señal o activación",C340,1,Desgaste normal del equipo,se evidencia falla toma corriente,4/08/2025,12:00:00,4/08/2025,15:00:00,X,3,MECE ORAS,1,2025-08-04 12:00:00,2025-08-04 15:00:00,3.0
20023787,CCA,OC-EST-CCA-PREC-CP,LINEA CONEXIÓN PROCESO BRAZOS PREFILTRAC,"TUBERIA 30"" ENTR BRAZOS PREFILTRAC",45005008.0,10048384.0,I_PI,236259,m2,goteo de crudo por bastago,3/08/2025,PO-I-040,Sub. Control y Monitoreo,I045,Tubería / Válvulas,SA-I-PI,ELP2,Fuga externa crudo - Fluido Proceso,C340,1,Desgaste normal del equipo,goteo de crudo por bastago,4/08/2025,7:00:00,4/08/2025,12:00:00,X,5,METR ORAS,2,2025-08-04 07:00:00,2025-08-04 12:00:00,5.0
20014377,CQO,OC-EST-CQO-AGEN-GE22010,GENERADOR PRINCIPAL 10,MOTOR COMB GE-010,42003447.0,10048364.0,R_CE,236258,m2,fuga turbo derecho lado b generador 10,3/08/2025,PO-R-020,Sub. Lubricación,R024,Sellos / Empaques,SA-R-CE,STD1,"Daño material, grietas, desgaste, corr.",C340,1,Desgaste normal del equipo,fuga turbo derecho lado b generador 10,4/08/2025,7:00:00,4/08/2025,12:00:00,X,5,MECE ORAS,3,2025-08-04 07:00:00,2025-08-04 12:00:00,5.0
20006144,CUS,OC-EST-DES-ALOC-ED,EDIFICACIONES,LOCACION CASETA CONDUCTORES,46000634.0,70020907.0,Z_XXXX,236264,m2,revis aacon caseta conductores descar,4/08/2025,PO-U-010,Sub. Aire Acondicionado,U012,Ventilador,SA-U-AI,FTF1,No resp bajo demanda o señal en emerg.,,0,,nan,4/08/2025,8:22:57,,0:00:00,X,0,MECE ORAS,1,2025-08-04 08:22:57,,0.0
20002895,EPO,OC-EST-EPO-ADRE-DC,DRENAJE CERRADO,SUMIDERO ACERO DC BOMBAS PRINCIPALES,45006438.0,10048393.0,U_OC,236270,m2,"trazas aceitosa sumidero bpc""s 53100",4/08/2025,PO-U-070,Sub. Misceláneos,U071,Filtro,SA-U-OC,STD1,"Daño material, grietas, desgaste, corr.",,0,,nan,4/08/2025,21:44:45,,0:00:00,X,0,METR ORAS,2,2025-08-04 21:44:45,,0.0
20015450,GRA,OC-EST-GRA-AGEN-GE22020,GENERADOR PRINCIPAL 20,TURBINA DE POTENCIA GAS GE20,42003393.0,10048361.0,R_ST,236254,m2,disparo turbge-20 alta vibracion ud13x1,2/08/2025,PO-R-030,Sub. Control y Monitoreo,R034,Unidad de Control,SA-R-ST,AIR1,"Falsa alarma, indicador defectuoso.",,0,,nan,2/08/2025,6:50:04,,0:00:00,X,0,METR ORAS,3,2025-08-02 06:50:04,,0.0
20010657,CCA,OC-EST-CCA-AELE-MT,SISTEMA MEDIA TENSIÓN CAUCACIA,"TRANSFORMADOR 13,2/0,48kV SWG20200",45005050.0,10048325.0,E_PT,236215,m2,goteo de aceite en tr-20100,17/04/2024,PO-E-050,Sub. Transformador,E050,Aceite Dieléctrico,SA-E-PT,STD1,"Daño material, grietas, desgaste, corr.",C340,1,Desgaste normal del equipo,goteo de aceite en tr-20100,1/08/2025,7:00:00,2/08/2025,17:00:00,X,34,MECE ORAS,2,2025-08-01 07:00:00,2025-08-02 17:00:00,
20016456,CQO,OC-EST-CQO-AGEN-GE22030,GENERADOR PRINCIPAL 30,SISTEMA ACEITE TERM EXHAUST GAS-THERMAL,,10048357.0,Z_XXXX,236244,m2,falla damper caldera generador 30,30/07/2025,PO-S-070,Sub. Actuador,S075,Sellos,SA-U-EA,STD1,"Daño material, grietas, desgaste, corr.",C340,1,Desgaste normal del equipo,falla damper caldera generador 30,1/08/2025,8:00:00,1/08/2025,12:00:00,X,4,MECE ORAS,1,2025-08-01 08:00:00,2025-08-01 12:00:00,4.0
20010896,CUS,OC-EST-DES-PMED-BE20010,MEDICIÓN CRUDO ENTRADA BE20010,VALVULA SOLENOIDE DESAIREADOR LY-300101A,,10048362.0,Z_XXXX,236251,m2,falla valv solenoid desairead ly-300101a,1/08/2025,VEDA,Desaireador,138,Cuerpo,SA-S-IN,ELP2,Fuga externa crudo - Fluido Proceso,C340,1,Desgaste normal del equipo,falla valv solenoid desairead ly-300101a,1/08/2025,18:00:00,1/08/2025,22:00:00,X,4,METR ORAS,1,2025-08-01 18:00:00,2025-08-01 22:00:00,4.0
20015450,GRA,OC-EST-GRA-AGEN-GE22020,GENERADOR PRINCIPAL 20,TURBINA DE POTENCIA GAS GE20,42003393.0,10048360.0,R_ST,236253,m2,disparo2 turb ge-20 alta vibracion ud13x,2/08/2025,PO-R-030,Sub. Control y Monitoreo,R030,Cableado y Caja de Conexiones,SA-R-ST,AIR1,"Falsa alarma, indicador defectuoso.",,0,,nan,1/08/2025,4:42:31,,0:00:00,X,0,METR ORAS,3,2025-08-01 04:42:31,,0.0
20002007,EPO,OC-EST-EPO-AAGU-RS,AGUA RESIDUAL,FILTRO F-58011 TRATAMIENTO DE AGUA,,10048213.0,I_FS,236055,m2,31struccion de lineas petar,3/06/2025,PO-I-010,Sub. Estructura e Internos,I014,Filtro / Elemento Filtrante,SA-I-FS,PLU3,Obstrucción Tubería por Agente Interno,C340,1,Desgaste normal del equipo,obstruccion de lineas petar,31/07/2025,9:00:00,31/07/2025,10:00:00,X,1,MECE ORAS,1,2025-07-31 09:00:00,2025-07-31 10:00:00,1.0
20021557,PAE,OC-EST-PAE-ALOC-CN,CONTENEDORES PAEZ,CONTAINER CAMPAMENTO MILITAR # 2,42004577.0,10048312.0,Z_XXXX,236200,m2,fallas aacon bases militares,15/07/2025,OCAC,Equipamiento de aire acondicionado,485,Unidad compresora,SA-U-AI,FTF1,No resp bajo demanda o señal en emerg.,C540,1,Causa Desconocida,fallas aacon bases militares,30/07/2025,7:00:00,30/07/2025,17:30:00,X,"10,5",MECE ORAS,1,2025-07-30 07:00:00,2025-07-30 17:30:00,10.5
20018724,VSA,OC-EST-VSA-PMED-PR3010,PROBADOR DE MEDICIÓN PR3010,ACTUADOR MOV-370007,,20195193.0,Z_XXXX,236246,m2,perdida de estado mov 370007,30/07/2025,ADNE,Actuador Neumatico,430,switch de posicion,SA-S-VA,FTO1,No abre cuando se da la orden,,0,,nan,30/07/2025,21:59:56,,0:00:00,X,0,MECE ORAS,1,2025-07-30 21:59:56,,0.0
20003457,EPO,OC-EST-EPO-ALOC-LO,LOTES O ÁREAS INFRAESTRUCT- ILUMNACION,LOCACION ZONA TANQUES ALMACENAMIENTO,46001010.0,10047935.0,Z_XXXX,235803,m2,falla de alumbrado area de generacion,30/03/2025,ALPE,Alumbrado Perimetral,344,Protecciones electricas,SA-E-EP,STD1,"Daño material, grietas, desgaste, corr.",C340,1,Desgaste normal del equipo,falla de alumbrado area de generacion,29/07/2025,7:00:00,30/07/2025,16:48:00,X,"33,8",MECE ORAS,1,2025-07-29 07:00:00,2025-07-30 16:48:00,
20003421,EPO,OC-EST-EPO-ALOC-ED,EDIFICACIONES,LOCACION CASETA DOSIFICACION DE QUIMICOS,46000794.0,10048217.0,Z_XXXX,236093,m2,falla de iluminacion caseta dosificacion,15/06/2025,ALED,Alumbrado Edificaciones,268,Luminarias,SA-U-IL,STD1,"Daño material, grietas, desgaste, corr.",C340,1,Desgaste normal del equipo,falla de iluminacion caseta dosificacion,29/07/2025,8:00:00,29/07/2025,10:00:00,X,2,MECE ORAS,1,2025-07-29 08:00:00,2025-07-29 10:00:00,2.0
20009831,CCA,OC-EST-CCA-ACOM-CR,SISTEMA DE CRUDO COMBUSTIBLE,VALVULA MOV ENT TC-52020,,10048314.0,S_VA,236202,m2,atascamiento mov 520211 entrada tc52020,16/07/2025,PO-S-060,Sub. Válvulas,S069,Actuador,SA-S-VA,PLU7,Atascamiento,C340,1,Desgaste normal del equipo,atascamiento mov 520211 entrada tc52020,29/07/2025,8:00:00,29/07/2025,11:00:00,X,3,MECE ORAS,1,2025-07-29 08:00:00,2025-07-29 11:00:00,3.0
20016387,EPO,OC-EST-EPO-AGEN-GE22110,GENERADOR PRINCIPAL 10,TURBINA GAS MULTIET. GE10 12.9 MW,42003489.0,10048413.0,R_ST,236237,m2,perdida de comunicacion vibraciones tg10,28/07/2025,PO-R-030,Sub. Control y Monitoreo,R033,Sensores,SA-R-ST,PDE1,Parámetro excede lim. superior/inferior,,0,,nan,29/07/2025,10:00:00,29/07/2025,12:00:00,X,2,MECE ORAS,3,2025-07-29 10:00:00,2025-07-29 12:00:00,2.0
20011384,CUS,OC-EST-DES-PREC-BH20100,BAHIA DE RECIBO BH20100,TRANSMISOR PRES DIF TFL2001001,,70020900.0,S_IN,236243,m2,cambio pdit-2001001 bahia 10 dsk,29/07/2025,PO-S-010,Sub. Control y monitoreo,S014,Indicador o Sensor,SA-S-IN,NOO1,No hay señal,,0,,nan,29/07/2025,16:46:47,,0:00:00,X,0,METR ORAS,2,2025-07-29 16:46:47,,0.0
20010899,CUS,OC-EST-DES-PMED-BE20010,MEDICIÓN CRUDO ENTRADA BE20010,MEDIDOR FLUJO BRAZO 10,42005434.0,10048342.0,S_IN,236230,m2,falla medidor flujo fqi-300102 b#1,25/07/2025,PO-E-020,Sub. Control y monitoreo / Protección,E021,Cableado y Caja de Conexiones,SA-U-EA,AIR2,Falsa alarma e indicación,C340,1,Desgaste normal del equipo,encoder presenta la falla,28/07/2025,7:00:00,28/07/2025,17:10:00,X,"10,17",MECE ORAS,3,2025-07-28 07:00:00,2025-07-28 17:10:00,10.17
20014377,CQO,OC-EST-CQO-AGEN-GE22010,GENERADOR PRINCIPAL 10,MOTOR COMB GE-010,42003447.0,10048347.0,R_CE,236238,m2,cambio de manguera sistema liqueos gen10,28/07/2025,PO-R-050,Sub. Combustión,R056,Control de Combustible (Gas / Diesel),SA-R-CE,STD1,"Daño material, grietas, desgaste, corr.",C340,1,Desgaste normal del equipo,cambio de manguera sistema liqueos gen10,28/07/2025,8:00:00,28/07/2025,17:30:00,X,"9,5",MECE ORAS,3,2025-07-28 08:00:00,2025-07-28 17:30:00,9.5
20011611,CVA,OC-TER-CVA-AAIR-BO,AIRE BOMBEO,COMPRESOR TORNILLO CO-54120,45002516.0,10048358.0,R_CO,236239,m2,falla compresor aire instrumentos,28/07/2025,PO-R-120,Sub. Compresión Aire,R127,Rotor,SA-R-CO,AIR1,"Falsa alarma, indicador defectuoso.",,0,,nan,28/07/2025,7:00:00,28/07/2025,17:30:00,,0,METR ORAS,1,2025-07-28 07:00:00,2025-07-28 17:30:00,0.0
20015450,GRA,OC-EST-GRA-AGEN-GE22020,GENERADOR PRINCIPAL 20,TURBINA DE POTENCIA GAS GE20,42003393.0,10048359.0,R_ST,236236,m2,disparo turb ge-20 alta vibracion ud13x1,28/07/2025,PO-S-010,Sub. Control y monitoreo,S014,Indicador o Sensor,SA-R-ST,VIB1,Vibración anormal,,0,,nan,28/07/2025,4:32:37,,0:00:00,X,0,METR ORAS,3,2025-07-28 04:32:37,,0.0
20010899,CUS,OC-EST-DES-PMED-BE20010,MEDICIÓN CRUDO ENTRADA BE20010,MEDIDOR FLUJO BRAZO 10,42005434.0,10048330.0,S_IN,236223,m2,falla medidor flujo fqi-300501 b#1,23/07/2025,PO-S-010,Sub. Control y monitoreo,S014,Indicador o Sensor,SA-S-IN,NOO1,No hay señal,C340,1,Desgaste normal del equipo,falla medidor flujo fqi-300501 b#1,27/07/2025,13:30:00,27/07/2025,15:30:00,X,2,MECE ORAS,3,2025-07-27 13:30:00,2025-07-27 15:30:00,2.0
20016387,EPO,OC-EST-EPO-AGEN-GE22110,GENERADOR PRINCIPAL 10,TURBINA GAS MULTIET. GE10 12.9 MW,42003489.0,10048412.0,R_ST,236232,m2,revisar alarma mac5 fire gas tg10,25/07/2025,PO-R-030,Sub. Control y Monitoreo,R033,Sensores,SA-R-ST,AIR1,"Falsa alarma, indicador defectuoso.",,0,,nan,27/07/2025,7:30:00,27/07/2025,10:30:00,X,3,MECE ORAS,3,2025-07-27 07:30:00,2025-07-27 10:30:00,3.0
20010668,CCA,OC-EST-CCA-AGEN-GE20200,GENERADOR AUXILIAR 20,MOTOR COMBUST DIESEL GE20200,45005004.0,10048344.0,R_CE,236235,m2,falla taponamiento de filtros de comb.,26/07/2025,PO-R-050,Sub. Combustión,R056,Control de Combustible (Gas / Diesel),SA-R-CE,PLU1,"Obstrucción lubric., refrig, aire o comb",C540,1,Causa Desconocida,falla taponamiento de filtros de comb.,26/07/2025,11:30:00,26/07/2025,14:30:00,X,3,MECE ORAS,2,2025-07-26 11:30:00,2025-07-26 14:30:00,3.0
20027602,EPO,OC-EST-EPO-ADRE-DC,DRENAJE CERRADO,BOMBA REINYECCION DC TS-301,,10048350.0,R_PU,236234,m2,falla bomba del sumidero fase 0,26/07/2025,PO-R-020,Sub. Lubricación,R022,Bomba,SA-R-PU,NOI1,Ruido fuera de lo Normal,,0,,nan,26/07/2025,11:58:56,,0:00:00,X,0,METR ORAS,2,2025-07-26 11:58:56,,0.0
20008876,EPO,OC-EST-EPO-PREC-LIALEPO,LÍNEA DE RECIBO ALTOS DE PORVENIR,VALVULA SHUTDOWN LINEA RECIBO ALEPO,45006059.0,10048349.0,S_VS,236233,m2,diferencial patin recibo altos,25/07/2025,PO-S-120,Sub. Misceláneos,S123,Estructura de Montaje / Soporte,SA-S-VS,STD1,"Daño material, grietas, desgaste, corr.",,0,,nan,25/07/2025,14:04:48,,0:00:00,X,0,METR ORAS,4,2025-07-25 14:04:48,,0.0
20009959,CUS,OC-EST-CUS-PSEP-TQSE020,TANQUES SEPARACIÓN SE50020,SEPARADOR CRUDO TSE50020,42002194.0,10048132.0,I_VE,236004,m2,falla displey controlador de lcv 500202,19/05/2025,PO-I-010,Sub. Estructura e Internos,I013,Cuerpo / Carcasa / Armazón,SA-I-VE,AIR1,"Falsa alarma, indic. defectuosa de inst.",C340,1,Desgaste normal del equipo,falla displey controlador de lcv 500202,24/07/2025,7:00:00,24/07/2025,17:10:00,X,"10,17",MECE ORAS,2,2025-07-24 07:00:00,2025-07-24 17:10:00,10.17
20008595,EPO,OC-EST-EPO-PALM-CPAL,CONEXIÓN ALMACENAMIENTO,LDS VALVULA MOV BOLA LINE INYECC QUIMICA,45003689.0,10048318.0,S_VA,236186,m2,atascamiento valvula drenaje agua tp-305,13/07/2025,PO-S-060,Sub. Válvulas,S068,Vástago,SA-S-VA,PLU7,Atascamiento,C340,1,Desgaste normal del equipo,atascamiento valvula drenaje,24/07/2025,9:00:00,24/07/2025,12:00:00,X,3,MECE ORAS,4,2025-07-24 09:00:00,2025-07-24 12:00:00,3.0
20022313,VSA,OC-EST-VSA-PMED-PR3010,PROBADOR DE MEDICIÓN PR3010,PROBADOR 3010,42004870.0,10048355.0,S_IN,236217,m2,prover inactivo mps-3010,22/07/2025,PO-S-010,Sub. Control y monitoreo,S014,Indicador o Sensor,SA-S-IN,ERO3,Señal errática,C310,1,Operación Fuera de parámetros,proveer inactivo,24/07/2025,8:00:00,24/07/2025,11:00:00,X,3,MECE ORAS,2,2025-07-24 08:00:00,2025-07-24 11:00:00,3.0
20003004,EPO,OC-EST-EPO-PREC-CPRE,CONEXIÓN DE RECIBO,TRANSMISOR FLUJO LINEA RECIBO CUS,,10048374.0,S_IN,236226,m2,falla medidor fqi-250115 entrada rb,24/07/2025,PO-S-010,Sub. Control y monitoreo,S014,Indicador o Sensor,SA-S-IN,AIR2,Falsa alarma e indicación,,0,,nan,24/07/2025,1:42:53,,0:00:00,X,0,METR ORAS,2,2025-07-24 01:42:53,,0.0
20017469,EPO,OC-EST-EPO-PMED-CA37010,MEDICIÓN CALIDAD CA37010,FAST LOOP CALIDAD,45003947.0,10048375.0,S_IN,236227,m2,falla densimetro de recibo santiago,24/07/2025,PO-S-010,Sub. Control y monitoreo,S014,Indicador o Sensor,SA-S-IN,AIR2,Falsa alarma e indicación,,0,,nan,24/07/2025,1:54:55,,0:00:00,X,0,METR ORAS,2,2025-07-24 01:54:55,,0.0
20010233,VSA,OC-EST-VSA-PREC-CPRE,CONEXIÓN DE RECIBO,VALVULA DE CONTROL DE FLUJO,45004529.0,10048354.0,S_VA,236229,m2,plato invertido mov370128,24/07/2025,PO-S-060,Sub. Válvulas,S063,Cuerpo de la Válvula,SA-S-VA,AIR2,Falsa alarma e indicación,C320,1,Error de Operación,no existe falla,24/07/2025,8:48:32,24/07/2025,10:48:00,X,"1,99",MECE ORAS,2,2025-07-24 08:48:32,2025-07-24 10:48:00,1.99
20001599,VSA,OC-EST-VSA-PMED-BE3620,BRAZO MEDICIÓN DE ENTRADA BE3620,VALVULA MOV_8X600- MUL 220-BE3620,45004398.0,10047093.0,S_VA,234813,m2,falla sello válvula mov3621,15/07/2024,PO-S-060,Sub. Válvulas,S067,Sellos,SA-S-VA,INP1,Pase interno,C340,1,Desgaste normal del equipo,desgaste de materiales,23/07/2025,7:00:00,23/07/2025,20:00:00,X,13,MECE ORAS,2,2025-07-23 07:00:00,2025-07-23 20:00:00,
20023257,CCA,OC-EST-CCA-ACOM-CR,SISTEMA DE CRUDO COMBUSTIBLE,MODULO SEP CENTRIF.CRUD COMBUST CE-5212,45005035.0,10048332.0,R_MS,236225,m2,centrifuga 2512 salida reiterativa-alta,23/07/2025,PO-R-030,Sub. Control y Monitoreo,R034,Unidad de Control,SA-R-MS,LOO4,Salida por Bajo Flujo,C340,1,Desgaste normal del equipo,centrifuga 2512 salida reiterativa-alta,23/07/2025,19:00:00,23/07/2025,22:00:00,X,3,MECE ORAS,1,2025-07-23 19:00:00,2025-07-23 22:00:00,3.0
20022771,CQO,OC-EST-CQO-ALOC-CN,CONTENEDORES,CONTAINER DORMITORIOS 8  - ESTACION,42004378.0,10048329.0,Z_XXXX,236220,m2,verificación cableado contenedor del rio,23/07/2025,ICEL,Control electronico,85,cable,SA-E-PC,FOV1,Voltaje salida equivocado o inestable,C340,1,Desgaste normal del equipo,verificación cableado contenedor del rio,23/07/2025,14:00:00,24/07/2025,12:00:00,X,22,MECE ORAS,1,2025-07-23 14:00:00,2025-07-24 12:00:00,
20008799,EPO,OC-EST-EPO-PMED-BE38020,BRAZO MEDICIÓN DE ENTRADA ALEPO 20,TRANSMISOR PRES DIF FILTRO BRAZO 2,,10048336.0,S_IN,236218,m2,falla transmisor presion altos medidor#2,23/07/2025,PO-S-010,Sub. Control y monitoreo,S014,Indicador o Sensor,SA-S-IN,AIR2,Falsa alarma e indicación,C340,1,Desgaste normal del equipo,señal quedó congelada,23/07/2025,9:00:00,23/07/2025,11:00:00,X,2,MECE ORAS,1,2025-07-23 09:00:00,2025-07-23 11:00:00,2.0
20010143,CVA,OC-TER-CVA-ALOC-IZ,IZAJE,BRAZO ARTICULADO CVA,42002521.0,10048351.0,I_CR,236242,m2,falla botella hidraulica manlift,29/07/2025,PO-R-030,Sub. Control y Monitoreo,R031,Actuador,SA-I-PI,ELP6,Fuga Sistema Sellos Mecánicos,C340,1,Desgaste normal del equipo,falla botella hidraulica manlift,23/07/2025,7:00:00,23/07/2025,16:00:00,X,9,MECE ORAS,1,2025-07-23 07:00:00,2025-07-23 16:00:00,9.0
20010562,CVA,OC-TER-CVA-PMED-BE36040,BRAZO MEDICIÓN DE ENTRADA BE36040,VALVULA MOV_12x150-DES 710-BE36040,45005427.0,10047910.0,S_VA,235742,m2,humedecimiento mov 360411 ms 36000,13/03/2025,PO-S-060,Sub. Válvulas,S069,Actuador,SA-S-VA,STD1,"Daño material, grietas, desgaste, corr.",C340,1,Desgaste normal del equipo,humedecimiento mov 360411 ms 36000,22/07/2025,10:00:00,22/07/2025,12:00:00,X,2,MECE ORAS,2,2025-07-22 10:00:00,2025-07-22 12:00:00,2.0
20001961,EPO,OC-EST-EPO-AAGU-PO,AGUA POTABLE,MOTOR ELECTRICO BA310,42002914.0,10048405.0,R_EM,236301,m2,falla medidor de agua de la bomba ba-310,22/07/2025,PO-R-030,Sub. Control y Monitoreo,R033,Sensores,SA-R-EM,STD1,"Daño material, grietas, desgaste, corr.",,0,,nan,22/07/2025,13:54:53,22/07/2025,14:00:00,,0,METR ORAS,1,2025-07-22 13:54:53,2025-07-22 14:00:00,0.0
20016102,EPO,OC-EST-EPO-AAGU-PO,AGUA POTABLE,TANQUE AGUA POTABLE 20,45005802.0,10048404.0,I_TA,236300,m2,falla medidor de agua a tanques elevados,22/07/2025,PO-I-010,Sub. Estructura e Internos,I013,Cuerpo / Carcasa / Armazón,SA-I-TA,BRD1,"Parada daño considerable, fisura, rotura",,0,,nan,22/07/2025,6:42:07,,0:00:00,X,0,METR ORAS,1,2025-07-22 06:42:07,,0.0
20016102,EPO,OC-EST-EPO-AAGU-PO,AGUA POTABLE,TANQUE AGUA POTABLE 20,45005802.0,10048404.0,I_TA,236299,m2,falla medidor de agua a tanques elevados,22/07/2025,PO-I-010,Sub. Estructura e Internos,I013,Cuerpo / Carcasa / Armazón,SA-I-TA,SER1,Piezas Mecánicas Sueltas,,0,,nan,22/07/2025,6:42:07,,0:00:00,X,0,METR ORAS,1,2025-07-22 06:42:07,,0.0
20024319,CVA,OC-TER-CVA-PALM-MU73,MÚLTIPLE DE ALMACENAMIENTO MU73,TRANSMISOR PRES MULTKS73,,10046245.0,S_IN,233763,m2,falla transmisor de presion 73100,27/12/2023,PO-S-010,Sub. Control y monitoreo,S014,Indicador o Sensor,SA-S-IN,NOO1,No hay señal,C340,1,Desgaste normal del equipo,falla transmisor de presion 73100,21/07/2025,13:00:00,22/07/2025,16:48:00,X,"27,8",MECE ORAS,2,2025-07-21 13:00:00,2025-07-22 16:48:00,
20021976,CUS,OC-EST-CUS-PALM-MUTK120,MÚLTIPLE DE ALMACENAMIENTO MU120,VALVULA MOV_30x150-ENT 950-MUTK120,,10048323.0,S_VA,236214,m2,atascamiento valvula mov-410108,21/07/2025,PO-S-060,Sub. Válvulas,S069,Actuador,SA-S-VA,PLU7,Atascamiento,,0,,nan,21/07/2025,7:00:00,21/07/2025,16:00:00,X,9,MECE ORAS,2,2025-07-21 07:00:00,2025-07-21 16:00:00,9.0
20015450,GRA,OC-EST-GRA-AGEN-GE22020,GENERADOR PRINCIPAL 20,TURBINA DE POTENCIA GAS GE20,42003393.0,10048343.0,R_ST,236213,m2,disparo turb 20 por bov1 posicion maxima,21/07/2025,PO-R-030,Sub. Control y Monitoreo,R034,Unidad de Control,SA-R-ST,PDE1,Parámetro excede lim. superior/inferior,,0,,nan,21/07/2025,9:30:00,21/07/2025,13:30:00,X,4,MECE ORAS,3,2025-07-21 09:30:00,2025-07-21 13:30:00,4.0
20022979,CQO,OC-EST-CQO-AELE-MTGE,SISTEMA ELECT MEDIA TENSION GENERA,CELDA 901-P4 ALIMENT INTERCONEXION 1,,10048321.0,E_SG,236211,m2,falla celda 901-p4 aliment interconex 1,20/07/2025,PO-E-020,Sub. Control y monitoreo / Protección,E026,Protecciones Eléctricas,SA-E-SE,FOV1,Voltaje salida equivocado o inestable,,0,,nan,20/07/2025,14:54:00,,0:00:00,X,0,METR ORAS,1,2025-07-20 14:54:00,,0.0
20023182,CQO,OC-EST-CQO-AAGU-PO,SISTEMA DE RECIBO AGUA POTABLE,BOMBA DOSIFICA CLORO #2,42004508.0,10048331.0,R_PU,236222,m2,falla bomba dosificadora de cloro,23/07/2025,PO-R-020,Sub. Lubricación,R022,Bomba,SA-R-PU,LOO4,Salida por Bajo Flujo,C340,1,Desgaste normal del equipo,falla bomba dosificadora de cloro,20/07/2025,7:00:00,20/07/2025,14:00:00,X,7,MECE ORAS,1,2025-07-20 07:00:00,2025-07-20 14:00:00,7.0
20023731,EPO,OC-EST-EPO-AELE-BTBPC,BAJA TENSIÓN BOMBAS PRINCIPALES,CENTRO CONTROL MOTORES 42000 REPO,42005353.0,10048271.0,E_MC,236156,m2,falla de comunicaciones de lazo#2,6/07/2025,PO-E-120,Sub. Misceláneos,E120,Cableado y Caja de Conexiones,SA-E-MC,AIR1,"Falsa alarma, indic. defectuosa de inst.",,0,,nan,18/07/2025,9:00:00,18/07/2025,18:00:00,X,9,MECE ORAS,3,2025-07-18 09:00:00,2025-07-18 18:00:00,9.0
20024035,EPO,OC-EST-EPO-SCIN-AU,AGUA CONTRAINCENDIOS,RED DISTRIBUCION AGUA SCI,,10048319.0,S_FE,236170,m2,falla contactor bomba jockey sci,10/07/2025,PO-S-060,Sub. Válvulas,S065,Elemento de cierre,SA-S-FE,FTF1,Equipos FireNo resp bajo demanda o señal en emerg. Gas- Extinción,C340,1,Desgaste normal del equipo,daño contactor principal,18/07/2025,7:00:00,18/07/2025,11:00:00,X,4,MECE ORAS,4,2025-07-18 07:00:00,2025-07-18 11:00:00,4.0
20017615,EPO,OC-EST-EPO-PMED-CA37010,MEDICIÓN CALIDAD CA37010,TOMAMUESTRAS CALIDAD 37,,10048320.0,S_IN,236209,m2,toma muestras santiago no funciona,18/07/2025,PO-S-120,Sub. Misceláneos,S120,Acumulador,SA-S-IN,AIR2,Falsa alarma e indicación,,0,,nan,18/07/2025,8:00:00,18/07/2025,17:00:00,X,9,METR ORAS,2,2025-07-18 08:00:00,2025-07-18 17:00:00,9.0
20023595,EPO,OC-EST-EPO-AGEN-GE22140,GENERADOR BLACK START 40,GENERADOR BLACKSTART GE40 0.48kV,42005346.0,10048281.0,R_EG,236167,m2,salida de generacion_apertura n7,9/07/2025,PO-R-030,Sub. Control y Monitoreo,R034,Unidad de Control,SA-R-EG,AIR1,"Falsa alarma, indicador defectuoso.",,0,,nan,16/07/2025,7:00:00,16/07/2025,12:00:00,X,5,MECE ORAS,1,2025-07-16 07:00:00,2025-07-16 12:00:00,5.0
20018328,EPO,OC-EST-EPO-AAGU-IN,AGUA INDUSTRIAL,BOMBA CENTRIFUGA BA310,45002790.0,10048371.0,R_PU,236194,m2,falla del medidor de salida ba 310,15/07/2025,PO-R-010,Sub. Transmisión,R010,Acoples,SA-R-PU,STD1,"Daño material, grietas, desgaste, corr.",,0,,nan,15/07/2025,6:19:55,,0:00:00,X,0,METR ORAS,1,2025-07-15 06:19:55,,0.0
20024033,EPO,OC-EST-EPO-SCIN-AU,AGUA CONTRAINCENDIOS,TANQUE AGUA CONTRAINCENDIO 301,45006466.0,10048372.0,S_FE,236196,m2,falla del medidor de entrada ta 301-5701,15/07/2025,PO-S-060,Sub. Válvulas,S066,Empaque,SA-S-FE,AIR2,Equipos FireFalsa alarma e indicación Gas- Extinción,,0,,nan,15/07/2025,6:48:38,,0:00:00,X,0,METR ORAS,4,2025-07-15 06:48:38,,0.0
20020903,CVA,OC-TER-CVA-PALM-CPAL,CONEXIÓN PROCESO ALMACENAMIENTO,TUBERIA CABEZAL DESC BT,45003870.0,10046674.0,I_PI,234395,m2,goteo en cheque linea de descarga de bts,20/04/2024,PO-I-070,Sub. Misceláneos,I071,Brida / Junta Bridada,SA-I-PI,ELP2,Fuga externa crudo - Fluido Proceso,C340,1,Desgaste normal del equipo,goteo en cheque linea de descarga de bts,14/07/2025,7:00:00,14/07/2025,17:00:00,X,10,MECE ORAS,2,2025-07-14 07:00:00,2025-07-14 17:00:00,10.0
20001583,VSA,OC-EST-VSA-PMED-BE3610,BRAZO MEDICIÓN DE ENTRADA BE3610,VALVULA MOV_8X600- PRB 220-BE3610,45004393.0,10048304.0,S_VA,236190,m2,pase de producto en valvula mov-3611,14/07/2025,PO-S-060,Sub. Válvulas,S067,Sellos,SA-S-VA,LCP1,Fuga por la válvula en posición cerrada,,0,,nan,14/07/2025,11:15:18,14/07/2025,11:15:18,X,0,METR ORAS,2,2025-07-14 11:15:18,2025-07-14 11:15:18,0.0
20007960,VSA,OC-EST-VSA-PMED-BE3670,BRAZO MEDICIÓN DE ENTRADA BE3670,ACTUADOR MOV-3671 BRAZO MEDICION 3670,,10048356.0,Z_XXXX,236191,m2,falla mov-3671 ms-3600,14/07/2025,ESCO,Compartimiento de control,158,Display,SA-E-SC,AIR1,"Falsa alarma, indicador defectuoso.",C340,1,Desgaste normal del equipo,humedad en actuador,14/07/2025,12:36:00,14/07/2025,14:00:00,X,"1,4",MECE ORAS,1,2025-07-14 12:36:00,2025-07-14 14:00:00,1.4
20004379,MRF,OC-EST-MRF-PDES-TG82000,TRAMPA DESPACHO TG82000,DETECTOR RASPADOR DESPACHO,,10048308.0,S_IN,236181,m2,falla en gis trampa de despacho.,12/07/2025,PO-S-010,Sub. Control y monitoreo,S014,Indicador o Sensor,SA-S-IN,NOO1,No hay señal,C540,1,Causa Desconocida,falla en gis trampa de despacho.,13/07/2025,14:00:00,13/07/2025,16:00:00,X,2,MECE ORAS,1,2025-07-13 14:00:00,2025-07-13 16:00:00,2.0
20022346,CUP,OC-EST-CUP-PDES-TG820005,TRAMPA DESPACHO TG820005,VALVULA MOV_16x600- SAL 960-TG820005,45004115.0,10048276.0,S_VA,236162,m2,falla tarjeta mov-5061 cupiagua,9/07/2025,PO-S-010,Sub. Control y monitoreo,S013,Circuitos o Componentes electrónicos,SA-S-VA,SPO1,Operación inesperada,C340,1,Desgaste normal del equipo,falla en su tarjeta main board,11/07/2025,11:00:00,11/07/2025,17:06:00,X,"6,1",MECE ORAS,4,2025-07-11 11:00:00,2025-07-11 17:06:00,6.1
20017469,EPO,OC-EST-EPO-PMED-CA37010,MEDICIÓN CALIDAD CA37010,FAST LOOP CALIDAD,45003947.0,10048283.0,S_IN,236168,m2,goteo de crudo bomba loop altos epo,10/07/2025,PO-S-120,Sub. Misceláneos,S121,Bomba portátil,SA-S-IN,ELP2,Fuga externa crudo - Fluido Proceso,,0,,nan,10/07/2025,9:30:30,11/07/2025,10:00:00,,0,METR ORAS,2,2025-07-10 09:30:30,2025-07-11 10:00:00,0.0
20025957,EPO,OC-EST-EPO-UENF-CCMPRINCIPAL,PAQUETE ENFRIAMIENTO CCM PRINCIPAL,AIRE AC SPLIT/VENT PQTE A CCM PRINCIPAL,,10047968.0,U_AI,235840,m2,compresor aires ccm en corto,7/04/2025,PO-U-010,Sub. Aire Acondicionado,U010,Compresor,SA-U-AI,FTF1,No resp bajo demanda o señal en emerg.,C340,1,Desgaste normal del equipo,compresor aires ccm en corto,9/07/2025,7:00:00,9/07/2025,17:00:00,X,10,MECE ORAS,2,2025-07-09 07:00:00,2025-07-09 17:00:00,10.0
20006305,CUP,OC-EST-CUP-PALM-TK50001,TANQUE DE ALMACENAMIENTO TK50001,AGITADOR D 5001,45004108.0,10048279.0,I_MI,236165,m2,revision ruido anormal agita agm-5001d,9/07/2025,PO-I-040,Sub. Control y Monitoreo,I043,Monitoreo (PLC - Tarjetas - sensores),SA-I-MI,NOI1,Ruido fuera de lo Normal,,0,,nan,9/07/2025,7:00:00,9/07/2025,9:00:00,X,2,MECE ORAS,1,2025-07-09 07:00:00,2025-07-09 09:00:00,2.0
20022276,VSA,OC-EST-VSA-PMED-BE3630,BRAZO MEDICIÓN DE ENTRADA BE3630,MEDIDOR FLUJO BRAZO MED 3630,45004406.0,10048275.0,S_IN,236163,m2,humedecimiento empaque fqe 3630 ms 3600,9/07/2025,PO-S-070,Sub. Actuador,S075,Sellos,SA-S-IN,ELP2,Fuga externa crudo - Fluido Proceso,C340,1,Desgaste normal del equipo,desgaste prensastopas packing gland,9/07/2025,8:00:36,9/07/2025,13:00:00,,0,MECE ORAS,3,2025-07-09 08:00:36,2025-07-09 13:00:00,0.0
20027457,CUS,OC-EST-CUS-AAGU-PO,AGUA POTABLE,PLANTA POTABILIZADORA AGUA LLUVIA,,,A_TP,236158,m2,fisura en manguera tubing hipoclorito,8/07/2025,PO-A-010,Sub. Mecánico,A012,Tubería,SA-A-TP,STD1,"Daño material, grietas, desgaste, corr.",,0,,nan,8/07/2025,8:00:17,,0:00:00,,0,MECE,2,2025-07-08 08:00:17,,0.0
20023256,CCA,OC-EST-CCA-ACOM-CR,SISTEMA DE CRUDO COMBUSTIBLE,MODULO SEP CENTRIF.CRUD COMBUST CE-5211,45005034.0,10048236.0,R_MS,236112,m2,falla bomba cenrifugadora 5211,18/06/2025,PO-R-040,Sub. Bombeo - Mezcla Fluidos,R047,Sellos,SA-R-MS,STD1,"Daño material, grietas, desgaste, corr.",C340,1,Desgaste normal del equipo,falla bomba cenrifugadora 5211,7/07/2025,8:00:00,7/07/2025,16:00:00,X,8,MECE ORAS,1,2025-07-07 08:00:00,2025-07-07 16:00:00,8.0
20003014,EPO,OC-EST-EPO-PREC-FL2402,BRAZO DE FILTRACIÓN RECIBO FL2402,VALVULA MOV_20x600-SAL 920-FL2402,45006046.0,10048272.0,S_VA,236157,m2,perdida de comunicasion v/v 240203,6/07/2025,PO-S-010,Sub. Control y monitoreo,S013,Circuitos o Componentes electrónicos,SA-S-VA,SPO1,Operación inesperada,C340,1,Desgaste normal del equipo,perdida de comunicasion v/v 240203,6/07/2025,8:00:00,6/07/2025,11:00:00,X,3,MECE ORAS,2,2025-07-06 08:00:00,2025-07-06 11:00:00,3.0
20004834,CVA,OC-TER-CVA-PALM-TK7314,TANQUE DE ALMACENAMIENTO TK7314,TANQUE ALMAC CRUDO TK7314,45005327.0,10048230.0,I_TA,236079,m2,cámaras de espumas del tk-7314 obstruida,12/06/2025,PO-I-020,Sub. Externo,I027,Tubería / Válvulas,SA-I-PI,PLU3,Obstrucción Tubería por Agente Interno,C340,1,Desgaste normal del equipo,cámaras de espumas del tk-7314 obstruida,4/07/2025,13:00:00,4/07/2025,17:00:00,X,4,MECE ORAS,3,2025-07-04 13:00:00,2025-07-04 17:00:00,4.0
20004854,CVA,OC-TER-CVA-PALM-TK7312,TANQUE DE ALMACENAMIENTO TK7312,TANQUE ALMAC CRUDO TK7312,45005316.0,10048231.0,I_TA,236077,m2,cámaras de espumas del tk-7312 obstruida,12/06/2025,PO-I-010,Sub. Estructura e Internos,I019,Tubería / Válvulas,SA-I-TA,PLU3,Obstrucción Tubería por Agente Interno,C340,1,Desgaste normal del equipo,cámaras de espumas del tk-7312 obstruida,4/07/2025,13:00:00,4/07/2025,17:00:00,X,4,MECE ORAS,3,2025-07-04 13:00:00,2025-07-04 17:00:00,4.0
20011146,CUS,OC-EST-DES-ALOC-ED,EDIFICACIONES,EDIFICACION CASETA BAHIAS,42005557.0,10048246.0,Z_XXXX,236124,m2,cambio resorte escalera b#6 por ruptura,24/06/2025,DWDW,Malacate,224,Guaya,SA-I-CR,SLP1,"Falla mec. Cable (Quiebre, rotura, etc)",C340,1,Desgaste normal del equipo,cambio resorte escalera b#6 por ruptura,4/07/2025,15:00:00,4/07/2025,17:00:00,X,2,MECE ORAS,1,2025-07-04 15:00:00,2025-07-04 17:00:00,2.0
20003241,EPO,OC-EST-EPO-ACOM-CRF2,CRUDO FASE 2,BOMBA CENTRIFUGA BC52030,45006374.0,10048240.0,R_PU,236109,m2,daño retenedor bomba sist porsfiltracion,18/06/2025,PO-R-040,Sub. Bombeo - Mezcla Fluidos,R047,Sellos,SA-R-PU,ELP3,Fuga ext. Combustible - Fluido Proceso,,1,,daño retenedor bomba sist porsfiltracion,3/07/2025,16:00:00,3/07/2025,17:12:00,X,"1,2",METR ORAS,2,2025-07-03 16:00:00,2025-07-03 17:12:00,1.2
20003335,EPO,OC-EST-EPO-ACOM-CRF2,CRUDO FASE 2,FILTRO CRUDO COMB BOMBA BC52030,,10048241.0,I_FS,236110,m2,alta diferecial filtro sist posfiltracio,18/06/2025,PO-I-010,Sub. Estructura e Internos,I014,Filtro / Elemento Filtrante,SA-I-FS,PLU3,Obstrucción Tubería por Agente Interno,C340,1,Desgaste normal del equipo,alta diferecial filtro sist posfiltracio,3/07/2025,7:00:00,3/07/2025,15:00:00,X,8,MECE ORAS,1,2025-07-03 07:00:00,2025-07-03 15:00:00,8.0
20011113,CUS,OC-EST-DES-PMED-PE01,MEDICION POR PESO,BASCULA CAMIONERA 2,,10048266.0,S_IN,236148,m2,ruptura celda bascula 1 descargadero,2/07/2025,PO-S-030,Sub. Suministro de Energía,S035,Controlado de carga,SA-S-IN,ERO3,Señal errática,C540,1,Causa Desconocida,ruptura celda bascula 1 descargadero,3/07/2025,7:00:00,3/07/2025,9:00:00,X,2,MECE ORAS,1,2025-07-03 07:00:00,2025-07-03 09:00:00,2.0
20010584,CVA,OC-TER-CVA-PMED-BS38010,BRAZO MEDICIÓN SALIDA BS38010,VALVULA MOV_16x150- DES 710-BS38010,45005474.0,10048225.0,S_VA,236104,m2,falla apertura mov 380111,17/06/2025,PO-E-020,Sub. Control y monitoreo / Protección,E024,Interfaz de Comunicación,SA-S-CM,ERO3,Señal errática,C340,1,Desgaste normal del equipo,falla apertura mov 380111,2/07/2025,7:00:00,2/07/2025,12:00:00,X,5,MECE ORAS,2,2025-07-02 07:00:00,2025-07-02 12:00:00,5.0
20010795,CUS,OC-EST-DES-PREC-BH20010,BAHIA DE RECIBO BH20010,BOMBA CENTRIFUGA BAHIA 10,42005491.0,10048265.0,R_PU,236147,m2,baja eficiencia alta vibracion bt-20010,2/07/2025,PO-R-040,Sub. Bombeo - Mezcla Fluidos,R044,Paletas,SA-R-PU,VIB1,Vibración anormal,C540,1,Causa Desconocida,baja eficiencia alta vibracion bt-20010,2/07/2025,11:30:00,2/07/2025,17:30:00,X,6,MECE ORAS,2,2025-07-02 11:30:00,2025-07-02 17:30:00,6.0
20010870,CUS,OC-EST-DES-PREC-BH20060,BAHIA DE RECIBO BH20060,BOMBA CENTRIFUGA BAHIA 60,42005476.0,10048264.0,R_PU,236146,m2,baja eficiencia alta vibracion bt-20060,2/07/2025,PO-R-040,Sub. Bombeo - Mezcla Fluidos,R044,Paletas,SA-R-PU,VIB1,Vibración anormal,C340,1,Desgaste normal del equipo,baja eficiencia alta vibracion bt-20060,2/07/2025,7:00:00,2/07/2025,11:00:00,X,4,MECE ORAS,2,2025-07-02 07:00:00,2025-07-02 11:00:00,4.0
20004328,MRF,OC-EST-MRF-PDES-LI,LÍNEA DESPACHO,ACTUADOR ELECTROHIDRAULICO ESDV-820024,,10047925.0,Z_XXXX,235771,m2,falla bomba sumergible bunker esdv despa,20/03/2025,PO-S-120,Sub. Misceláneos,S121,Bomba portátil,SA-S-VA,STD1,"Daño material, grietas, desgaste, corr.",C340,1,Desgaste normal del equipo,falla bomba sumergible bunker esdv despa,1/07/2025,7:00:00,1/07/2025,17:30:00,,0,METR ORAS,4,2025-07-01 07:00:00,2025-07-01 17:30:00,0.0
20022645,CQO,OC-EST-CQO-PDES-LI,LINEA SALIDA ESTACIONN CHIQUILLO,TRANSMISOR FLUJO SAL ESTACION,,10048201.0,S_IN,236090,m2,falla lectura medidor fi220001 est chi,14/06/2025,PO-R-030,Sub. Control y Monitoreo,R033,Sensores,SA-I-PI,AIR1,"Falsa alarma, indic. defectuosa de inst.",C340,1,Desgaste normal del equipo,falla lectura medidor fi220001 est chi,1/07/2025,7:00:00,23/07/2025,17:00:00,X,538,MECE ORAS,2,2025-07-01 07:00:00,2025-07-23 17:00:00,
20005946,CCA,OC-EST-CCA-ADRE-DA,DRENAJE DEL SUMIDERO,BOMBA ELECTROSUMERGIBLE BU-53020,42003666.0,10048235.0,R_PU,236100,m2,falla sistema automatico bomba,16/06/2025,PO-R-030,Sub. Control y Monitoreo,R033,Sensores,SA-R-PU,AIR1,"Falsa alarma, indicador defectuoso.",C340,1,Desgaste normal del equipo,falla sistema automatico bomba,1/07/2025,7:30:00,1/07/2025,10:00:00,X,"2,5",MECE ORAS,2,2025-07-01 07:30:00,2025-07-01 10:00:00,2.5
20011419,CUS,OC-EST-DES-PMED-BE20070,MEDICIÓN CRUDO ENTRADA BE20070,VALVULA MOV_4x150- SAL 950-BE20070,42005735.0,10048263.0,S_VA,236143,m2,falla mov-300731 brazo 7 descargadero,30/06/2025,PO-S-060,Sub. Válvulas,S069,Actuador,SA-S-VA,AIR2,Falsa alarma e indicación,C540,1,Causa Desconocida,falla mov-300731 brazo 7 descargadero,1/07/2025,7:00:00,1/07/2025,12:00:00,X,5,MECE ORAS,2,2025-07-01 07:00:00,2025-07-01 12:00:00,5.0
20013332,CCA,OC-EST-CCA-ACOM-GA,SISTEMA DE COMBUSTIBLE GAS,TUBERIA RED DISTRIBUCIO BPC'S,45005022.0,10047867.0,Z_XXXX,235695,m2,pase valvulas aseguramiento tev-420-201,4/03/2025,PO-S-060,Sub. Válvulas,S063,Cuerpo de la Válvula,SA-S-VM,ELP3,Fuga ext. Combustible - Fluido Proceso,,0,,nan,28/06/2025,7:00:00,28/06/2025,17:30:00,,0,METR ORAS,1,2025-06-28 07:00:00,2025-06-28 17:30:00,0.0
20023671,EPO,OC-EST-EPO-PMED-PR38100,PROBADOR DE MEDICIÓN PR38100,PROBADOR ALTOS DEL PORVENIR,42005286.0,10048009.0,S_IN,235824,m2,lleno recipiente toma muestra altos,2/04/2025,PO-S-010,Sub. Control y monitoreo,S018,Válvula solenoide,SA-S-IN,ELP2,Fuga externa crudo - Fluido Proceso,C340,1,Desgaste normal del equipo,lleno recipiente toma muestra altos,28/06/2025,7:00:00,28/06/2025,14:00:00,X,7,MECE ORAS,2,2025-06-28 07:00:00,2025-06-28 14:00:00,7.0
20004346,MRF,OC-EST-MRF-PREC-TG22000,TRAMPA RECIBO TG24000,DETECTOR RASPADOR ENTRADA TG22000,,,S_IN,236137,m2,falla indicador recibo raspador,27/06/2025,PO-S-010,Sub. Control y monitoreo,S014,Indicador o Sensor,SA-S-IN,AIR2,Falsa alarma e indicación,,0,,nan,27/06/2025,13:20:28,,0:00:00,,0,MECE,1,2025-06-27 13:20:28,,0.0
20011007,CUS,OC-EST-DES-PMED-BE20050,MEDICIÓN CRUDO ENTRADA BE20050,MEDIDOR FLUJO BRAZO 50,42005450.0,10048255.0,S_IN,236133,m2,falla medidor flujo fqi-300501 b 5 dsk,26/06/2025,PO-S-010,Sub. Control y monitoreo,S014,Indicador o Sensor,SA-S-IN,FTF2,No resp bajo demanda o señal en Operac,C540,1,Causa Desconocida,falla medidor flujo fqi-300501 b 5 dsk,26/06/2025,7:00:00,26/06/2025,17:06:00,X,"10,1",MECE ORAS,3,2025-06-26 07:00:00,2025-06-26 17:06:00,10.1
20002898,EPO,OC-EST-EPO-AELE-BTALM,BAJA TENSIÓN ALMACENAMIENTO,AIRE ACONDICIONADO 920-AC-20300,45006455.0,10048328.0,E_EP,236160,m2,corto circuito aacon swg-20300 tankfarm,8/07/2025,PO-E-010,Sub. Circuito Alimentación,E014,Interruptor,SA-E-EP,FLL1,Alta Corriente,C340,1,Desgaste normal del equipo,contactor ocasionando el cortocircuito,26/06/2025,8:00:00,26/06/2025,11:00:00,X,3,MECE ORAS,2,2025-06-26 08:00:00,2025-06-26 11:00:00,3.0
20011001,CUS,OC-EST-DES-PMED-BE20050,MEDICIÓN CRUDO ENTRADA BE20050,FILTRO TFL300501,42005449.0,10048280.0,I_FS,236129,m2,humedecim drenaje filtro tfl-300501,25/06/2025,PO-I-040,Sub. Control y Monitoreo,I045,Tubería / Válvulas,SA-I-FS,STD1,"Daño material, grietas, desgaste, corr.",,0,,nan,25/06/2025,7:00:00,25/06/2025,9:00:00,X,2,MECE ORAS,1,2025-06-25 07:00:00,2025-06-25 09:00:00,2.0
20010475,EPO,OC-EST-EPO-ACOM-SEII,SEPARADOR CRUDO PRINCIPAL FASE II,TANQUE AGUA 52300,,10048254.0,I_TA,236128,m2,centrifuga b falla switch nivel agua,25/06/2025,PO-I-010,Sub. Estructura e Internos,I014,Filtro / Elemento Filtrante,SA-I-TA,AIR1,"Falsa alarma, indic. defectuosa de inst.",,0,,nan,25/06/2025,10:37:47,25/06/2025,11:00:00,,0,MECE ORAS,1,2025-06-25 10:37:47,2025-06-25 11:00:00,0.0
20017882,CVA,OC-TER-CVA-SALV-TQ5500,TANQUE RELEVO ALIVIO TQ5500,SWITCH NIVEL ALTO-ALTO TQ55000,,10048188.0,S_IN,236083,m2,falla de sw de nivel alto,12/06/2025,PO-S-010,Sub. Control y monitoreo,S014,Indicador o Sensor,SA-S-IN,AIR2,Falsa alarma e indicación,C340,1,Desgaste normal del equipo,falla de sw de nivel alto,24/06/2025,7:00:00,24/06/2025,12:00:00,X,5,MECE ORAS,4,2025-06-24 07:00:00,2025-06-24 12:00:00,5.0
20017883,CVA,OC-TER-CVA-SALV-TQ5500,TANQUE RELEVO ALIVIO TQ5500,SWITCH NIVEL BAJO-BAJO TQ55000,,10048189.0,S_IN,236084,m2,falla de sw de nivel bajo,12/06/2025,PO-S-010,Sub. Control y monitoreo,S014,Indicador o Sensor,SA-S-IN,AIR2,Falsa alarma e indicación,C340,1,Desgaste normal del equipo,falla de sw de nivel bajo,24/06/2025,13:00:00,24/06/2025,18:00:00,X,5,MECE ORAS,4,2025-06-24 13:00:00,2025-06-24 18:00:00,5.0
20018398,EPO,OC-EST-EPO-AAGU-DE,AGUA DESMINERALIZADA,SISTEMA DE POST-TRATAMIENTO,,10048239.0,Z_XXXX,236074,m2,falla bomba d paquete d agua desminerali,12/06/2025,ADHY,Actuador Hidráulico,2,Aceite,SA-R-PU,AIR1,"Falsa alarma, indicador defectuoso.",,0,,nan,24/06/2025,7:00:00,24/06/2025,15:00:00,X,8,MECE ORAS,1,2025-06-24 07:00:00,2025-06-24 15:00:00,8.0
20018723,VSA,OC-EST-VSA-PMED-PR3010,PROBADOR DE MEDICIÓN PR3010,VALVULA MOV_8X600- DES 220-PR3010,42004865.0,10048268.0,S_VA,236118,m2,atascamiento mov-370007,21/06/2025,ADME,Actuador Mecánico,4,Acople Bastago,SA-S-VA,FTO1,No abre cuando se da la orden,C320,1,Error de Operación,atascamiento,24/06/2025,7:00:00,24/06/2025,8:00:00,X,1,MECE ORAS,2,2025-06-24 07:00:00,2025-06-24 08:00:00,1.0
20010439,EPO,OC-EST-EPO-ACOM-MZ1,CRUDO MEZCLA,TANQUE CRUDO TC52080,45006359.0,10048244.0,I_TA,236123,m2,goteo de crudo en agitador del tc-52080,24/06/2025,PO-I-020,Sub. Externo,I025,Sellos / Juntas,SA-I-TA,ELP2,Fuga externa crudo - Fluido Proceso,,0,,nan,24/06/2025,11:38:09,,0:00:00,X,0,METR ORAS,2,2025-06-24 11:38:09,,0.0
20001123,CUS,OC-EST-CUS-PMED-PR5101,PROBADOR DE MEDICIÓN PR5101,TRANSMISOR TEMP PROBADOR 5101,,10048184.0,S_IN,236069,m2,falla temperatura probador,10/06/2025,PO-S-010,Sub. Control y monitoreo,S014,Indicador o Sensor,SA-S-IN,AIR2,Falsa alarma e indicación,C340,1,Desgaste normal del equipo,falla temperatura probador,21/06/2025,13:30:00,21/06/2025,17:30:00,X,4,MECE ORAS,1,2025-06-21 13:30:00,2025-06-21 17:30:00,4.0
20010695,VSA,OC-EST-VSA-UENF-PQEF,PAQUETE ENFRIAMIENTO,AIRE AC PQE VARIADORES 2,45004567.0,10044730.0,U_AI,232155,m2,perdida de presión und compreso ac paq 2,1/03/2023,PO-U-010,Sub. Aire Acondicionado,U010,Compresor,SA-U-AI,FTF1,No resp bajo demanda o señal en emerg.,C340,1,Desgaste normal del equipo,unidad compresora en mal estado,20/06/2025,8:00:00,20/06/2025,15:00:00,X,7,MECE ORAS,2,2025-06-20 08:00:00,2025-06-20 15:00:00,7.0
20008449,CUS,OC-EST-CUS-AELE-PC,PROTECCIÓN CATÓDICA,RECTIFICADOR TK4102,45006721.0,10048249.0,I_CP,236117,m2,revision proteccion disparada rtf 4101a,20/06/2025,PO-I-070,Sub. Misceláneos,I072,Protección Contra Rayos,SA-I-CP,PLU1,Obstrucción / restricción,,0,,nan,20/06/2025,9:05:20,,0:00:00,X,0,METR ORAS,2,2025-06-20 09:05:20,,0.0
20005306,CVA,OC-TER-CVA-ADRE-DC,DRENAJE CERRADO,SUMIDERO ACERO DC BOMBEO,45002880.0,10048257.0,U_OC,236126,m2,falla bomba sotano ccm principal,25/06/2025,PO-U-070,Sub. Misceláneos,U071,Filtro,SA-U-OC,STD1,"Daño material, grietas, desgaste, corr.",C340,1,Desgaste normal del equipo,falla bomba sotano ccm principal,20/06/2025,8:00:00,20/06/2025,16:00:00,,0,MECE ORAS,2,2025-06-20 08:00:00,2025-06-20 16:00:00,0.0
20023643,EPO,OC-EST-EPO-PDES-LI,LINEA DESPACHO,LINEA DESPACHO A EST PAEZ,,10048229.0,I_PI,236106,m2,humedecimiento pit-820013 despacho miraf,18/06/2025,PO-I-040,Sub. Control y Monitoreo,I045,Tubería / Válvulas,SA-I-PI,ELP2,Fuga externa crudo - Fluido Proceso,C340,1,Desgaste normal del equipo,humedecimiento pit-820013 despacho miraf,19/06/2025,7:00:00,19/06/2025,12:00:00,X,5,MECE ORAS,2,2025-06-19 07:00:00,2025-06-19 12:00:00,5.0
20024035,EPO,OC-EST-EPO-SCIN-AU,AGUA CONTRAINCENDIOS,RED DISTRIBUCION AGUA SCI,,10047668.0,S_FE,235451,m2,falla bomba jockey del sci,7/01/2025,PO-S-090,Sub. Bombeo SCI - F G,S090,Sub. Bombeo SCI - FCuerpo Bomba SCI G,SA-S-FE,AIR2,Equipos FireFalsa alarma e indicación Gas- Extinción,C340,1,Desgaste normal del equipo,falla bomba jockey del sci,18/06/2025,15:00:00,18/06/2025,17:12:00,X,"2,2",MECE ORAS,4,2025-06-18 15:00:00,2025-06-18 17:12:00,2.2
20006145,CUS,OC-EST-DES-ALOC-ED,EDIFICACIONES,LOCACION CASETA BASCULA,46000826.0,10048171.0,Z_XXXX,236054,m2,falla a/a caseta bascula,3/06/2025,PO-U-010,Sub. Aire Acondicionado,U010,Compresor,SA-U-AI,FTF1,No resp bajo demanda o señal en emerg.,C340,1,Desgaste normal del equipo,falla a/a caseta bascula,18/06/2025,7:00:00,18/06/2025,17:30:00,X,"10,5",MECE ORAS,1,2025-06-18 07:00:00,2025-06-18 17:30:00,10.5
20015300,GRA,OC-EST-GRA-SCIN-LP,SISTEMA DE AGENTE LIMPIO GRANJITA,MODULO MONITOREO SHELTER GENERACION,,10048226.0,Z_XXXX,236105,m2,falla modulo analogo fire&gas e-house,18/06/2025,PO-R-030,Sub. Control y Monitoreo,R033,Sensores,SA-S-FD,FTF1,Equipos FireNo resp bajo demanda o señal en emerg. Gas - Detecc.,,0,,nan,18/06/2025,1:47:31,,0:00:00,X,0,METR ORAS,4,2025-06-18 01:47:31,,0.0
20007903,VSA,OC-EST-VSA-PMED-BS37060,BRAZO MEDICIÓN SALIDA BS37060,ACTUADOR FCV-370607 BRAZO 37060,,10047860.0,Z_XXXX,235693,m2,falla en operacion de controladora fcv-6,4/03/2025,ADEN,Actuador Electroneumatico,430,switch de posicion,SA-S-CL,ERO3,Señal errática,C310,1,Operación Fuera de parámetros,deficiencia en control de flujo,17/06/2025,7:00:00,17/06/2025,14:00:00,X,7,MECE ORAS,1,2025-06-17 07:00:00,2025-06-17 14:00:00,7.0
20003146,EPO,OC-EST-EPO-PMED-BEMOY,BRAZO MEDICIÓN DE ENTRADA MONTERREY 1,VALVULA MOV_8x150- MED 920-MONTERREY 1,45006026.0,10047995.0,S_VA,235812,m2,valvula corte psv-392 entrada apiay,31/03/2025,PO-S-060,Sub. Válvulas,S065,Elemento de cierre,SA-S-VA,STD1,"Daño material, grietas, desgaste, corr.",C340,1,Desgaste normal del equipo,eje roto,17/06/2025,14:00:00,29/07/2025,17:00:00,X,"1.011,00",MECE ORAS,2,2025-06-17 14:00:00,2025-07-29 17:00:00,
20025725,EPO,OC-EST-EPO-ADRE-AA,SISTEMA DE AGUAS ACEITOSAS,SEPARADOR API,,10048126.0,A_TI,235929,m2,falla bomba de aspersion separador api,3/05/2025,PO-A-020,Sub. Eléctrico e Instrumentación,A020,Motor de Rotación,SA-A-TI,PLU5,Obstrucción / restricción,C340,1,Desgaste normal del equipo,falla bomba de aspersion separador api,17/06/2025,14:00:00,17/06/2025,16:00:00,X,2,MECE ORAS,2,2025-06-17 14:00:00,2025-06-17 16:00:00,2.0
20010664,CCA,OC-EST-CCA-AELE-BT,SISTEMA ELECTRICO BAJA TENSION,TABLERO ELECTRICO DISTRI ALUMBRADO EXT,,10048317.0,E_EP,236101,m2,falla sistema de iluminacion sala de maq,17/06/2025,PO-E-010,Sub. Circuito Alimentación,E017,Terminación del Cable,SA-E-EP,AIR1,"Falsa alarma, indic. defectuosa de inst.",,0,,nan,17/06/2025,0:09:52,,0:00:00,,0,METR ORAS,2,2025-06-17 00:09:52,,0.0
20004866,CVA,OC-TER-CVA-PALM-TK7312,TANQUE DE ALMACENAMIENTO TK7312,VALVULA CHEQUE TK7312,45005324.0,10044300.0,S_VM,231704,m2,válvulas de drenaje de dique no cierran,13/12/2022,PO-S-060,Sub. Válvulas,S063,Cuerpo de la Válvula,SA-S-VM,PLU7,Atascamiento,C340,1,Desgaste normal del equipo,válvulas de drenaje de dique no cierran,16/06/2025,7:00:00,21/06/2025,17:00:00,,0,MECE ORAS,1,2025-06-16 07:00:00,2025-06-21 17:00:00,0.0
20003406,EPO,OC-EST-EPO-ACOM-CRGEN,CRUDO GEN,TANQUE CRUDO COMB GEN TC52060,45002698.0,10047479.0,I_TA,235204,m2,daño platinas de ruptura tc-52060,24/10/2024,PO-I-010,Sub. Estructura e Internos,I016,"Placas, Bandejas, Paletas, Almohadillas",SA-I-TA,STD1,"Daño material, grietas, desgaste, corr.",C340,1,Desgaste normal del equipo,daño platinas de ruptura tc-52060,16/06/2025,11:00:00,16/06/2025,17:00:00,X,6,MECE ORAS,2,2025-06-16 11:00:00,2025-06-16 17:00:00,6.0
20025941,CVA,OC-TER-CVA-PALM-TK12020,TANQUE DE ALMACENAMIENTO TK12020,HV CORTE DRENAJE AGUA LLUVIA TK 12020,,10048232.0,S_VM,236097,m2,hv corte drenaje aguas lluvias de dique,16/06/2025,PO-S-060,Sub. Válvulas,S063,Cuerpo de la Válvula,SA-S-VM,PLU7,Atascamiento,,0,,nan,16/06/2025,0:33:23,,0:00:00,X,0,METR ORAS,2,2025-06-16 00:33:23,,0.0
20007850,VSA,OC-EST-VSA-PDES-TG83000,TRAMPA DESPACHO TG83000,ACTUADOR MOV-830006 DE TG-83000,,10048175.0,Z_XXXX,236048,m2,valvula mov-830006 atascada,2/06/2025,ADME,Actuador Mecánico,4,Acople Bastago,SA-S-VA,PLU7,Atascamiento,C320,1,Error de Operación,presion diferecial elevada,14/06/2025,14:00:00,14/06/2025,17:00:00,X,3,MECE ORAS,1,2025-06-14 14:00:00,2025-06-14 17:00:00,3.0
20009690,CUS,OC-EST-DES-PREC-CPRE,CONEXIÓN DE RECIBO,VALVULA CTRL PRES CABEZAL BRAZOS,42002584.0,10048202.0,S_VA,236091,m2,falla de apertura pcv-300002 dsk,14/06/2025,PO-E-020,Sub. Control y monitoreo / Protección,E021,Cableado y Caja de Conexiones,SA-S-VA,SPO1,Operación inesperada,C340,1,Desgaste normal del equipo,falla de apertura pcv-300002 dsk,14/06/2025,11:00:00,14/06/2025,17:00:00,X,6,MECE ORAS,2,2025-06-14 11:00:00,2025-06-14 17:00:00,6.0
20006271,LBE,OC-EST-LBE-AAGU-RS,AGUA RESIDUAL,STARD BASE MILITAR,42004026.0,10048173.0,A_TD,236060,m2,falla motor soplador ptar base mil,5/06/2025,PO-A-010,Sub. Mecánico,A011,Bomba,SA-A-TD,STD1,"Daño material, grietas, desgaste, corr.",C340,1,Desgaste normal del equipo,falla motor soplador ptar base mil,13/06/2025,8:00:00,13/06/2025,14:30:00,,0,MECE ORAS,1,2025-06-13 08:00:00,2025-06-13 14:30:00,0.0
20024949,MRF,OC-EST-MRF-SCIN-DT,DETECTORES CONTRAINCENDIOS,PANEL SCI MONITOREADO_AREA 05,,10048181.0,S_CL,236068,m2,falla comunicaciones sist contraincendio,9/06/2025,PO-E-020,Sub. Control y monitoreo / Protección,E024,Interfaz de Comunicación,SA-S-FD,FTF1,Equipos FireNo resp bajo demanda o señal en emerg. Gas - Detecc.,C340,1,Desgaste normal del equipo,falla comunicaciones sist contraincendio,13/06/2025,7:30:00,19/06/2025,17:30:00,,0,MECE ORAS,4,2025-06-13 07:30:00,2025-06-19 17:30:00,0.0
20010870,CUS,OC-EST-DES-PREC-BH20060,BAHIA DE RECIBO BH20060,BOMBA CENTRIFUGA BAHIA 60,42005476.0,10048190.0,R_PU,236085,m2,goteo por junta flex. succ. bahia #6,13/06/2025,PO-R-010,Sub. Transmisión,R010,Acoples,SA-R-PU,ELP4,Fuga externa de Agua -Fluido de Proceso,C340,1,Desgaste normal del equipo,goteo de producto por junta,13/06/2025,7:00:00,13/06/2025,10:00:00,X,3,MECE ORAS,2,2025-06-13 07:00:00,2025-06-13 10:00:00,3.0
20002014,EPO,OC-EST-EPO-AAGU-RS,AGUA RESIDUAL,TANQUE TRATAMIENTO AGUA RESIDUAL 1,45005812.0,10048214.0,I_TA,236088,m2,lineas tapadas planta ptar,13/06/2025,PO-I-040,Sub. Control y Monitoreo,I045,Tubería / Válvulas,SA-I-TA,PLU3,Obstrucción Tubería por Agente Interno,,0,,nan,13/06/2025,11:31:04,13/06/2025,14:00:00,,0,METR ORAS,1,2025-06-13 11:31:04,2025-06-13 14:00:00,0.0
20010475,EPO,OC-EST-EPO-ACOM-SEII,SEPARADOR CRUDO PRINCIPAL FASE II,TANQUE AGUA 52300,,10048219.0,I_TA,236087,m2,falla switche entrada agua centrifuga-b,13/06/2025,PO-I-040,Sub. Control y Monitoreo,I043,Monitoreo (PLC - Tarjetas - sensores),SA-I-TA,STD1,"Daño material, grietas, desgaste, corr.",C340,1,Desgaste normal del equipo,falla switche entrada agua centrifuga-b,13/06/2025,15:00:00,13/06/2025,20:00:00,X,5,MECE ORAS,1,2025-06-13 15:00:00,2025-06-13 20:00:00,5.0
20002756,EPO,OC-EST-EPO-SCIN-AU,AGUA CONTRAINCENDIOS,HIDRANTE HMA-40 DE CONTRA INCENDIO AGUA,,10048118.0,S_FE,235927,m2,"goteo agua v/v 4"" hma-40",2/05/2025,PO-S-060,Sub. Válvulas,S066,Empaque,SA-S-FE,FTF1,Equipos FireNo resp bajo demanda o señal en emerg. Gas- Extinción,C340,1,Desgaste normal del equipo,"goteo agua v/v 4"" hma-40",12/06/2025,7:00:00,12/06/2025,10:00:00,X,3,MECE ORAS,1,2025-06-12 07:00:00,2025-06-12 10:00:00,3.0
20004811,CVA,OC-TER-CVA-PALM-TK7311,TANQUE DE ALMACENAMIENTO TK7311,TANQUE ALMAC CRUDO TK7311,45005304.0,10048227.0,I_TA,236076,m2,cámaras de espumas del tk-7311 obstruida,12/06/2025,PO-I-040,Sub. Control y Monitoreo,I045,Tubería / Válvulas,SA-I-TA,PLU3,Obstrucción Tubería por Agente Interno,,0,,nan,12/06/2025,11:42:50,,0:00:00,X,0,METR ORAS,3,2025-06-12 11:42:50,,0.0
20004833,CVA,OC-TER-CVA-PALM-TK7313,TANQUE DE ALMACENAMIENTO TK7313,TANQUE ALMAC NAFTA TK7313,45005405.0,10048228.0,I_TA,236078,m2,cámaras de espumas del tk-7313 obstruida,12/06/2025,PO-I-010,Sub. Estructura e Internos,I019,Tubería / Válvulas,SA-I-TA,PLU3,Obstrucción Tubería por Agente Interno,,0,,nan,12/06/2025,11:57:14,,0:00:00,X,0,METR ORAS,3,2025-06-12 11:57:14,,0.0
20027613,CUS,OC-EST-CUS-PALM-MUTK120,MÚLTIPLE DE ALMACENAMIENTO MU120,VALVULA MOV_30x150- ENT 950-MUTK120,,10047826.0,S_VA,235680,m2,rotura en gear box mov-410309,1/03/2025,PO-S-060,Sub. Válvulas,S069,Actuador,SA-S-VA,PLU7,Atascamiento,C340,1,Desgaste normal del equipo,rotura en gear box mov-410309,11/06/2025,7:00:00,11/06/2025,17:30:00,X,"10,5",MECE ORAS,3,2025-06-11 07:00:00,2025-06-11 17:30:00,10.5
20003097,EPO,OC-EST-EPO-PREC-TG25000,TRAMPA RECIBO TG25000,TRAMPA RECIBO CUS-EPO,45006062.0,10047992.0,I_VE,235849,m2,posible falla de guaya trampa recibo cus,10/04/2025,PO-I-020,Sub. Externo,I026,Pedestal / Soporte,SA-I-VE,STD1,"Daño material, grietas, desgaste, corr.",C540,1,Causa Desconocida,posible falla de guaya trampa recibo cus,11/06/2025,9:00:00,11/06/2025,11:00:00,X,2,MECE ORAS,2,2025-06-11 09:00:00,2025-06-11 11:00:00,2.0
20003098,EPO,OC-EST-EPO-PDES-TG82000,TRAMPA DESPACHO TG82000,VASIJA TRAMPA DESPACHO EPO-PAE,45006009.0,10047993.0,I_VE,235846,m2,ruptura en guaya trampa despacho mrf,10/04/2025,PO-I-020,Sub. Externo,I022,Cuerpo / Carcasa / Armazón,SA-I-VE,STD1,"Daño material, grietas, desgaste, corr.",C340,1,Desgaste normal del equipo,ruptura en guaya trampa despacho mrf,11/06/2025,7:00:00,11/06/2025,9:00:00,X,2,MECE ORAS,2,2025-06-11 07:00:00,2025-06-11 09:00:00,2.0
20002742,EPO,OC-EST-EPO-SCIN-AU,AGUA CONTRAINCENDIOS,HIDRANTE HMA-28 DE CONTRA INCENDIO AGUA,,10048117.0,S_FE,235926,m2,"goteo agua v/v 4"" hma-28",2/05/2025,PO-S-060,Sub. Válvulas,S067,Sellos,SA-S-FE,FTF1,Equipos FireNo resp bajo demanda o señal en emerg. Gas- Extinción,C340,1,Desgaste normal del equipo,"goteo agua v/v 4"" hma-28",11/06/2025,7:00:00,11/06/2025,10:00:00,X,3,MECE ORAS,1,2025-06-11 07:00:00,2025-06-11 10:00:00,3.0
20022281,VSA,OC-EST-VSA-PMED-BE3680,BRAZO MEDICIÓN DE ENTRADA BE3680,MEDIDOR FLUJO BRAZO MED 80,45004431.0,10048180.0,S_IN,236066,m2,brazo 8 ms 3600 no registra flujo,8/06/2025,PO-S-010,Sub. Control y monitoreo,S014,Indicador o Sensor,SA-S-IN,FTF2,No resp bajo demanda o señal en Operac,C340,1,Desgaste normal del equipo,desgaste de materiales,11/06/2025,7:00:00,11/06/2025,15:00:00,X,8,MECE ORAS,3,2025-06-11 07:00:00,2025-06-11 15:00:00,8.0
20022276,VSA,OC-EST-VSA-PMED-BE3630,BRAZO MEDICIÓN DE ENTRADA BE3630,MEDIDOR FLUJO BRAZO MED 3630,45004406.0,10048109.0,S_IN,235975,m2,no registra flujo medidor fqe 36030,12/05/2025,PO-S-010,Sub. Control y monitoreo,S014,Indicador o Sensor,SA-S-IN,NOO1,No hay señal,C310,1,Operación Fuera de parámetros,desgaste de materiales,10/06/2025,7:00:00,10/06/2025,15:00:00,X,8,MECE ORAS,3,2025-06-10 07:00:00,2025-06-10 15:00:00,8.0
20025497,CUS,OC-EST-CUS-PALM-MUTK120,MÚLTIPLE DE ALMACENAMIENTO MU120,VALVULA MOV_30x150- ENT 950-MUTK120,42005513.0,10048139.0,S_VA,236023,m2,instalacion tapa gear box mov 410307,23/05/2025,PO-S-070,Sub. Actuador,S077,Vástago,SA-S-VA,STD1,"Daño material, grietas, desgaste, corr.",C340,1,Desgaste normal del equipo,reposicion tapa gear box,10/06/2025,10:00:00,10/06/2025,12:00:00,X,2,MECE ORAS,3,2025-06-10 10:00:00,2025-06-10 12:00:00,2.0
20010694,VSA,OC-EST-VSA-UENF-PQEF,PAQUETE ENFRIAMIENTO,AIRE AC PQE VARIADORES 1,45004566.0,10048032.0,U_AI,235914,m2,mtto cvo a/a ccm variadore pq-1-2-3-4,28/04/2025,PO-U-010,Sub. Aire Acondicionado,U012,Ventilador,SA-U-AI,FTF1,No resp bajo demanda o señal en emerg.,C340,1,Desgaste normal del equipo,deterioro de componentes,9/06/2025,9:00:00,9/06/2025,16:00:00,X,7,MECE ORAS,2,2025-06-09 09:00:00,2025-06-09 16:00:00,7.0
20010472,EPO,OC-EST-EPO-ACOM-SEII,SEPARADOR CRUDO PRINCIPAL FASE II,MODULO SEP CENTRIF. FASE II PRINCIPAL,45002721.0,10048121.0,R_MS,235974,m2,goteo producto alfa laval 52300,12/05/2025,PO-R-040,Sub. Bombeo - Mezcla Fluidos,R047,Sellos,SA-R-MS,STD1,"Daño material, grietas, desgaste, corr.",C340,1,Desgaste normal del equipo,goteo producto alfa laval 52300,9/06/2025,10:00:00,9/06/2025,12:30:00,X,"2,5",MECE ORAS,1,2025-06-09 10:00:00,2025-06-09 12:30:00,2.5
20001657,VSA,OC-EST-VSA-PMED-BE3660,BRAZO MEDICIÓN DE ENTRADA BE3660,TRANSMISOR FLUJO BRAZO MED 60,,10048177.0,S_IN,236063,m2,falla transmisor de flujo brz 6 ms-3600,7/06/2025,PO-S-010,Sub. Control y monitoreo,S013,Circuitos o Componentes electrónicos,SA-S-IN,ERO3,Señal errática,C310,1,Operación Fuera de parámetros,cambio del rango de setting pit-3660,9/06/2025,8:00:00,9/06/2025,10:00:00,X,2,MECE ORAS,3,2025-06-09 08:00:00,2025-06-09 10:00:00,2.0
20001225,VSA,OC-EST-VSA-SALV-PR,ALIVIO PRESIÓN,VALVULA SEG PSV-2309 DE FILTRO FASE I,,10048179.0,S_VS,236065,m2,psv 2309 goteo por racor,8/06/2025,PO-S-060,Sub. Válvulas,S066,Empaque,SA-S-VS,ELP2,Fuga externa crudo - Fluido Proceso,C340,1,Desgaste normal del equipo,fuga de producto por racor,8/06/2025,12:00:00,8/06/2025,14:00:00,X,2,MECE ORAS,4,2025-06-08 12:00:00,2025-06-08 14:00:00,2.0
20021111,GRA,OC-EST-GRA-SCIN-LP,SISTEMA DE AGENTE LIMPIO GRANJITA,SISTEMA AGENTE LIMPIO SHELTER GENERACIÓN,42004774.0,10043420.0,S_FE,230594,m2,civalco sistema f&g e-house,11/05/2022,PO-S-050,Sub. Monitor - Hidrante,S052,Mecanismo Accionamiento (Volante),SA-S-FE,FTF1,Equipos FireNo resp bajo demanda o señal en emerg. Gas- Extinción,,0,,nan,6/06/2025,8:00:00,6/06/2025,12:30:00,X,"4,5",MECE ORAS,3,2025-06-06 08:00:00,2025-06-06 12:30:00,4.5
20003447,EPO,OC-EST-EPO-ALOC-ED,EDIFICACIONES,EDIFICACION SALA OPERACIONES,,10048115.0,Z_XXXX,235951,m2,falla sistema de altavoz y alarma zonora,9/05/2025,PCPC,Cables de Poder y Terminales,451,Terminal,SA-E-PC,FOV1,Voltaje salida equivocado o inestable,C340,1,Desgaste normal del equipo,falla sistema de altavoz y alarma zonora,6/06/2025,7:00:00,6/06/2025,12:00:00,X,5,MECE ORAS,1,2025-06-06 07:00:00,2025-06-06 12:00:00,5.0
20011431,CUS,OC-EST-DES-PMED-BE20080,MEDICIÓN CRUDO ENTRADA BE20080,VALVULA CTRL SALI BRAZO 80,42005463.0,10048069.0,S_VA,235965,m2,falla lcv300801,10/05/2025,PO-R-010,Sub. Transmisión,R010,Acoples,SA-S-CL,SER1,Piezas Mecánicas Sueltas,C340,1,Desgaste normal del equipo,daño diafragma,6/06/2025,11:00:00,6/06/2025,16:30:00,X,"5,5",MECE ORAS,3,2025-06-06 11:00:00,2025-06-06 16:30:00,5.5
20024035,EPO,OC-EST-EPO-SCIN-AU,AGUA CONTRAINCENDIOS,RED DISTRIBUCION AGUA SCI,,10048125.0,S_FE,235972,m2,falla automatico hidroflo sci,12/05/2025,PO-S-080,Sub. Motor Combustión SCI,S082,Cableado y Caja de Conexiones,SA-S-FE,AIR2,Equipos FireFalsa alarma e indicación Gas- Extinción,C340,1,Desgaste normal del equipo,falla automatico hidroflo sci,6/06/2025,7:00:00,6/06/2025,11:00:00,X,4,MECE ORAS,4,2025-06-06 07:00:00,2025-06-06 11:00:00,4.0
20011039,CUS,OC-EST-DES-PMED-BE20060,MEDICIÓN CRUDO ENTRADA BE20060,TRANSMISOR TEMP SALI BRAZO 60,,10048174.0,S_IN,236061,m2,lectura errone en la temp del producto,6/06/2025,PO-S-010,Sub. Control y monitoreo,S014,Indicador o Sensor,SA-S-IN,NOO1,No hay señal,C340,1,Desgaste normal del equipo,lectura errone en la temp del producto,6/06/2025,7:00:00,6/06/2025,17:06:00,X,"10,1",MECE ORAS,1,2025-06-06 07:00:00,2025-06-06 17:06:00,10.1
